Filename,Speaker,Manx,English
DQ_02.wav,,"As dooyrt mee, 'Ta mee toiggal yn glare shoh, gyn ourys' 'Bheil e fosgailte fhathast?' dooyrt ish. As dooyrt mee rish my charrey, 'Dooyrt ish ""is it open yet?"" ?' 'Tha thu ceart. Tha thu ag ionnsachadh. You're learning' T'ee yn un red. T'ad gra thàinig - haink. Chì mi thu. As ooilley ny earrooyn, ooilley ny verbyn, dagh ooilley red, t'ad ooilley yn un red, agh t'ad fockley magh eh ayns aght beggan quaagh. My row shiu geddyn cliaghtit rish t'eh aashagh dy liooar dy toiggal eh.","And I said, 'I understand this language, without doubt' 'Is it open yet?' she said. And I said to my friend, 'Did she say ""is it open yet?""?' 'You're right. You're learning.' It's the same thing. They say thàinig – 'haink' [came]. Chì mi thu [see you]. And all the numbers, all the verbs, everything, they're all the same, but they pronounce it in a bit of a strange way. If you get used to it it's easy enough to understand it."
DQ_02.wav,,"Agh t'adsyn loayrt Gallic feiy'n laa gagh laa. Agh v'adsyn gra dy vel eh goll sheese y lhargagh ec y traa t'ayn, as dooyrt shenn fer insee ta cummal ayns Barra, dooyrt eshyn rhym's, 'Ta dooinney loayrt Baarle ayns gagh chorneil jeh gagh thie gagh oie' V'eh loayrt mychione yn chelveish. As dooyrt eh, va shenn sleih goit er y Vaarle er yn oyr dy vel ad smooinnaghtyn dy vel eh cool dy ve loayrt ass y Vaarle. Cha nel eh cool dy ve loayrt ass y Ghallic. Shen myr dooyrt yn dooinney shen.","But they speak Gallic all day every day. But they said that it's going downhill at the moment, and an old teacher who lives in Barra, he said to me, 'There's a man speaking English in every corner of every home every night.' He was talking about the television. And he said old people were taken by English because they thought it was cool to be speaking in English. It's not cool to be speaking Gallic. That's what this man said."
DQ_02.wav,,S'bastagh shen. Vel oo son goll dys Barra mleeaney?,That's a shame. Are you going to Barra this year?
DQ_02.wav,,"Aye, ayns mee ny ghaa. Ta mee er ve ayn jeih turrys, er lhiam's.","Aye, in a month or two. I've been on ten trips, I think."
DQ_02.wav,,C'raad t'ou tannaghtyn?,Where do you stay?
DQ_02.wav,,"Well, boayl erbee. Ta mee geddyn bwaane mar is trice. Mar is trice, ta shen Gallic, ghooinney. Mar is trice - 'most often'.","Well, anywhere. I get a cottage mar is trice. Mar is trice, that's Gallic, man. Mar is trice – 'most often'."
DQ_02.wav,,Ny s'menkey.,More often.
DQ_02.wav,,"Ta mee geddyn caillt, ny keayrtyn, eddyr y ghlare Vanninagh as y Ghallic.","I get lost, sometimes, between the Manx language and Gallic."
DQ_02.wav,,"Foddym toiggal shen. T'eh beggan doillee, nagh vel? Feer vie. Cre nee oo 'sy tourey ansherbee? Vel oo son jannoo veg? Well, goll dys Barra.","I can understand that. It's a bit difficult, isn't it? Very good. What are you doing in the summer anyway? Are you doing anything? Well, going to Barra."
DQ_02.wav,,"Aye, as goll gys y Rank dy chur shilley er my inneen. T'ee ayns yn ard scoill ayns shen. T'ee jannoo studeyrys er Frangish, as delladys. Delladys, t'ad gra rish.","Aye, and going to France to visit my daughter. She's at university there. She's studying French and business, I think. Business, they call it."
DQ_02.wav,,C'raad sy Rank?,Where in France?
DQ_02.wav,,"Leon, er lhiam's t'ee ayn. Eisht sy fouyr er lhiam's dy vel ee goll gys Bordeaux son jannoo startey son blein, agh lurg shen t'ee jannoo yn blein sy jerrey ec ard scoill ayns Chester, eisht foddee dy bee degree ecksh.","Leon, I think she's in. Then in the autumn I think that she's going to Bordeaux to work for a year, but after that she's doing the final year at university in Chester, then maybe she'll have a degree."
DQ_02.wav,,As c'red t'ee geearree- laccal jannoo lurg shen?,And what does she want to do after that?
DQ_02.wav,,Cha nel ish smooinaghtyn mychione y lhied shen. T'ee just smooinaghtyn mychione goll magh er yn oie ec y traa t'ayn.,She's not thinking about that type of thing. She's just thinking about going out at night at the moment.
DQ_02.wav,,Cre'n fa nagh.,Why not.
DQ_02.wav,,"T'ee jannoo delladys as t'ee jannoo Frangish. Ta mish er gra, 'Bee startey mie ayd's ayns Ellan Vannin' 'Oh, cha nel. Beeym goll ooilley mygeayrt y theihll' dooyrt ee. Hee shin.","She's doing business and she's doing French. I've said, 'There'll be a good job on the Isle of Man' 'Oh, no. I'll be going all round the world' she said. We will see."
DQ_03.wav,,As cre mychione dty vac? Vel eh gobbraghey mayrt er y vaatey?,And what about your son? Is he working with you on the boat?
DQ_03.wav,,Er y vaatey. T'eh er ve er y vaatey three bleeaney nish. T'eh jannoo dy mie. Dooinney lajer. Dooinney braew t'eh. As tra ta mish my haaue s'treisht lhiam bee eshyn goll magh ayns y vaatey eh hene. S'treisht lhiam.,"On the boat. He's been on the boat three years now. He's doing well. Strong fella. Fine fella, he is. And when I'm retired I hope he'll go out on the boat himself. I hope."
DQ_03.wav,,"As bee obbyr ry gheddyn er y cheayn 'sy traa ry heet, t'ou smooinaghtyn?","And will there be work on the sea in the future, do you think?"
DQ_03.wav,,"Er lhiam. Bee dy kinjagh reddyn 'sy keayn. Er lhiam's. T'ou lhaih, mennick dy liooar, ayns y pabyryn niaght mychione. T'ad gra dy vel ooilley ny mooiryn er n'gheddyn baase as stoo myr shen. Cha nel shen kiart. Ta cho monney cretooryn ayns y cheayn myr va rieau, er lhiam's. Ny keayrtyn ta millioonyn jeu.","I think so. There will always be things in the sea. I think. You read, quite often, in the newspapers about it. They say that all the seas have died and things like that. It's not right. There's as many creatures in the sea as there ever was, I think. Sometimes millions of them."
DQ_03.wav,,"Vel? Vel oo- Gow er, ghooinney.","Is there? Do you—Go on, man."
DQ_03.wav,,Vel oo rieau goll er y cholloo er chor erbee?,Do you ever go to the Calf at all?
DQ_03.wav,,"Ny keaytyn. Tra ta lane tidey ayn ta shin goll stiagh ayns yn Purt y Jiass ny keayrtyn as shooyl mygeayrt son lhieh oor as ersooyl lhien. Son sorch dy, cha nel laaghyn seyrey, but lieh oor dy aash, my t'ou laccal.","Sometimes. When it's high tide we go into South Harbour sometimes and walk about for half an hour and then away. For a sort of, not holiday, but half an hour of rest, if you like."
DQ_03.wav,,As vel monney sleih goll er yn eeastagh son gimmee ec yn traa t'ayn?,And are there many people fishing for lobsters at the moment?
DQ_03.wav,,"Oh, ram jeu.","Oh, lots of them."
DQ_03.wav,,"Rour, foddee?","Too many, perhaps?"
DQ_03.wav,,"Well, foddee rouyr. Agh ooilley mygeayrt yn ellan nish t'ad ooilley goll gys yn eeastaght. Agh ta kuse jeu jannoo dy mie, as fir elley, well, tuittym, cheu yn raad, my t'ou laccal. Ta kuse jeu jannoo dy mie. She obbyr creoi t'ayn, 'sy yeurey ansherbee.","Well, perhaps too many. But all around the Island now they are all going fishing. But a few of them are doing well, and others, well, falling by the wayside, if you like. A few of them are doing well. It's hard work, in the winter anyway."
DQ_03.wav,,"S'cooin lhiam yn kied geurey va my vac marym er y vaatey. V'eh feer feer feayr, as va mee boirit nagh bee eshyn coontey monney jeh goll ec yn eeastagh. V'eh dy kinjagh gra, 'Daddy, ta mee bunnys riojit' Agh, well, shen yn aght. Shen y bea ec mooir er lhiam, ghooinney.","I remember the first winter my son was with me on the boat. He was very, very cold, and I was worried that he wouldn't think much of going fishing. He was always saying, 'Daddy, I'm almost frozen.' But, well, that's the way. That's the life at sea I think, man."
DQ_03.wav,,"Vel oo beggan danjeyragh goll magh, nish as reesht, er yn cheayn? Vel oo beggan danjeyragh?","Are you a bit dangerous in going out, now and then, on the sea? Are you a bit dangerous?"
DQ_03.wav,,"Cha nel. Ta shin dy kinjagh faggys da ny creggyn. Myr ta fys eu, ta ny gimmee ooilley fuirraght faggys da ny creggyn. Agh ta mee er woalley bunnys dagh ooilley creg ooilley mygeayrt yn Ellan harrish ny bleeantyn, ghooinney.","No. We always stay close to the rocks. As you know, the lobsters all stay close to the rocks. But I've hit almost every rock all around the Island over the years, man."
DQ_03.wav,,Ta mee toiggal shen.,I understand that.
DQ_03.wav,,"Oh, dy jarroo.","Oh, indeed."
DQ_03.wav,,As bee oo goll magh mairagh?,And will you be going out tomorrow?
DQ_03.wav,,"Bee shin. Foddee, well, ta yn tidey beggan neu handy ec y traa t'ayn. Bee eh quieg er y chlag 'sy voghrey, er lhiam's.","We will. Maybe, well, the tide is a bit awkward at the moment. It will be five o'clock in the morning, I think."
DQ_03.wav,,So bee oo er yn cheayn ec quieg er y chlag 'sy voghrey?,So will you be on the sea at five o'clock in the morning?
DQ_03.wav,,"Quieg er y chlag 'sy voghrey. Just lesh yn tidey. Mannagh bee shin jannoo shen bee eh ro anmagh goll ny s'anmey 'syn laa, my t'ou laccal.","Five o'clock in the morning. Just with the tide. If we don't do that it will be too late to go later in the day, if you like."
DQ_03.wav,,As cre'n traa hig oo erash?,What time will you come back?
DQ_03.wav,,"Bee shin erash mysh jeih [sic] er y chlag 'syn astyr, er lhiam.","We will be back about two [the English says two o'clock but the Manx says jeih er y chlag which is 'ten o'clock'; presumably a slip in the English. We'll keep the English as provided] in the evening, I think."
DQ_03.wav,,Shen dy liooar gyn dooyt erbee.,"That's enough, definitely."
DQ_03.wav,,"Well, ta shen dy jarroo. My vees eh feer heh myr v'eh jea ta mee geddyn skee, ghooinney, lesh yn chiass.","Well, it is indeed. If it's very hot like it was today I get tired, man, with the heat."
DQ_03.wav,,Mie lhiat cummal 'sy thie shoh nish? V'ou cummal ayns Purt le Moirrey rish bleeantyn.,Do you like living in this house now? You lived in Port St. Mary for years.
DQ_03.wav,,"Well, s'mie lhiam's Purt le Moirrey agh va ny thieyn ro costallagh er nyn son ayns shen. Va shin cur shilley er thie va dooinney enmyssit Bob Moorhouse cummal ayn ayns Fistard ayns shen. Foddee ta three shamyr cadlee ayn, shen ooilley, as v'eh ayns staid kiart dy liooar, as va mish er y chelvane rish yn dooinney ayns Purt Çhiarn ayns shoh, 'Cre'n prios ta er yn thie ayns Fistard?' as dooyrt eshyn, 'Kiare cheead thousane dy lieh' er lhiam's. Son yn thie y lhied myr shen. Four hundred and fifty thousand.","Well, I like Port St. Mary but the houses were too expensive for us there. We looked at a house that a man called Bob Moorhouse lived in in Fistard. There were probably three bedrooms, that's all, and it was in a good enough state, and I was on the telephone to the man in Port Erin here, 'What price is the house in Fistard?' and he said, 'Four hundred and fifty thousand pounds' I think. For a house like that. Four hundred and fifty thousand."
DQ_03.wav,,"Dooyrt mee rish my ven, 'Cha bee shin kionnaghey thie elley ayns Purt le Moirrey. T'ad ro costallagh'","I said to my wife, 'We won't be buying another house in Port St. Mary. They're too expensive.'"
DQ_03.wav,,"Well cha nel monney thieyn ayns Purt le Moirrey, shen yn boirrey. Son yn chooid smoo t'ad costallagh.","Well there aren't many houses in Port St. Mary, that's the problem. They are usually expensive."
DQ_03.wav,,"T'ad ro costallagh. Er my hon ansherbee. As haink yn thie shoh er y vargey as va shen yn prios kiart, as ren shin kionnaghey yn thie shoh. T'eh kiart dy liooar. Myr ta shiu fakin ta reayrt yindyssagh veih yn uinnag, nagh vel?","They're too expensive. For me anyway. And this house came on the market and that was the right price, and we bought this house. It's alright. As you can see there's a wonderful view out of the window, isn't there?"
DQ_03.wav,,"Oh, gyn dooyt erbee. Just jeeaghyn er yn Cholloo as-","Oh, definitely. Just looking at the Calf and-"
DQ_03.wav,,"Oh, dy jarroo. As Baie Fine, as ooilley myr shen.","Oh, indeed. As Baie Fine, and all that."
DQ_03.wav,,T'ou maynrey dy liooar cummal ayns shoh ansherbee.,You're happy enough living here anyway.
DQ_03.wav,,"Oh, dy jarroo. T'eh kiart dy liooar.","Oh, indeed. It's alright."
DQ_03.wav,,As vel oo foast jannoo monney studeyrys er yn Ghaelg?,And do you still study Manx much?
DQ_03.wav,,Oh dy jarroo. Ta ram lioaryn fo'n voayrd ayns shen.,"Oh, indeed. There are lots of books under the table there."
DQ_03.wav,,"Honnick mee adsyn. Jeeaghyn feer impressive, ghooinney.","I saw those. Looking very impressive, man."
DQ_03.wav,,"Ta'n chooid share ayns Gaelg, kuse jeu ayns Gallic. Skeeal ny ghaa ayns shen ayns y neesht jeu.","Most of them are in Manx, a few in Gallic. A few stories there in both."
DQ_03.wav,,As dooyrt oo roie tra v'ou aeg ren oo goll magh shooyl as ren oo clashtyn- Adsyn loayrt ass yn Ghaelg. Va shen Ned as dooinney elley. Cha nel mee shickyr quoi va'n dooinney elley.,And you said before when you were young you went out walking and heard—Them speaking in Manx. That was Ned and another man. I'm not sure who the other man was.
DQ_03.wav,,As c'raad va shen? Ayns Creneash or er y raad?,And where was that? In Cregneash or on the road?
DQ_03.wav,,"Er y raad gys y Cheyllys ayns shen. V'ad loayrt ry cheilley cho aashagh, v'eh yindyssagh clashtyn ad. Cha nel mee shickyr quoi va'n dooinney elley agh v'ad ny neesht jeu jeh'n un eash, my t'ou laccal. Daa henn deiney as maidjaghyn shooyl maroo, as v'ad loayrt cho aashagh ass yn Ghaelg. V'ad flaaoil, ny neesht jeu. Ta mee er smooinaghtyn ram keayrtyn quoi va'n dooinney elley. Foddee eh ve braar Ned.","On the road to the Sound there. They were speaking together so easily, it was wonderful to hear them. I'm not sure who the other man was but they were both the same age, if you like. Two old men with walking sticks, and they were speaking so easily in Manx. They were fluent, both of them. I have wondered many times who the other man was. It could be Ned's brother."
DQ_03.wav,,"Ta mee er chlashtyn Jackie y Mackerel, v'ad gra rish. Ta mee er chlashtyn dy row Gaelg yindyssagh echey. V'eh foddey ny share na Ned, ta mee er chlashtyn, agh cha row eshyn son loayrt monney, ta mee er chlashtyn.","I've heard Jackie Mackerel, they called him. I've heard that he had wonderful Manx. He was much better than Ned, I have heard, but he didn't like to speak much, I've heard."
DQ_03.wav,,Skeeal cadjin. S'bastagh shen. Ta mee er chlashtyn shen.,It's a common story. It's a shame. I've heard that.
DQ_03.wav,,"T'ad gra Jackie y Mackerel rish son far-ennym. Agh cha nel mee shickyr quoi v'eshyn. Ta shen erskyn tree feed bleeantyn er dy henney. As v'ad ny neesht jeu, ec y traa shen- t'eh doillee tra ta shiuish beg, but er lhiam's dy row ad mysh three feed bleeaney dy eash ny neesht jeu, er lhiam's ec y traa shen. V'ad flaaoil, gyn ourys.","They call him Jackie Mackerel as a nickname. But I'm not sure who he was. That's more than sixty years ago. And they were both, at that time—it's difficult when you're little, but I think they were about sixty years old each at that time. They were fluent, without doubt."
DQ_03.wav,,"Tra v'ou aeg foddee dy row ram baatyn eeastee ayns Purt le Moirrey, as y lhied.","When you were young there were probably lots of fishing boats in Port St. Mary, and the like."
DQ_03.wav,,"Oh, va. T'ad bunnys ooilley ersooyl nish. Va ram jeu. V'ad geddyn troggit ayns Nalpin bunnys gagh vlein as çheet gys shoh. Agh lheie ad ooilley ersooyl. Dooar yn chooid share jeh ny skipperyn baase tra v'ad aeg. Ram jeu. Foddym smooinaghtyn er, foddee, hoght jeu er n'gheddyn baase. Cha row fer jeu erskyn three feed bleeaney d'eash. V'ad ooilley er n'gheddyn baase, as va ooilley ny baatyn eeastee creckit. Ooilley ersooyl. Ta kuse jeu foast goll gys y eeastagh ass Purt ny h-Inshey, cha nel monney ayns Doolish. Ta kuse jeu ayns Rhumsaa. Ta'n flod ersooyl veih Purt le Moirrey ec y traa t'ayn. Dy jarroo.","Oh, there were. They're almost all gone now. There were lots of them. They were being built in Scotland almost every year and coming here. But they all melted away. Most of the skippers died when they were young. Many of them. I can think of, maybe, eight of them who have died. Not one of them was over sixty years old. They had all died, and all the fishing boats were sold. All gone. A few of them still go fishing out of Peel, not many in Douglas. There are a few in Ramsey. The fleet is gone from Port St. Mary at the moment. Indeed."
DQ_03.wav,,As ec yn traa shen va foast ram shappyn ayns Purt le Moirrey as yn lhied.,And at that time there were still lots of shops in Port St. Mary and the like.
DQ_03.wav,,"Oh, dy jarroo. Oddagh shiu kionnaghey red erbee ayns Purt le Moirrey ec yn traa shen. Un oie va mee my hoie ayns shoh as va mee screeu sheese ooilley ny shappyn va ayn, goaill toshiaght veih Yn Ablet gys yn shooylaghyn ayns shen, as va dossanyn jeu, creck dy chooilley red. Va foddee mysh kiare jeu creck feill, as adsyn va creck arran, va kuse jeu ayn, as creck lossreeyn. Va turneyr ayn, as va- quoi elley v'ayn? Dooinney creck braagyn. Ooilley stoo myr shen. Cha nel ad ayn nish.","Oh, indeed. You could buy anything in Port St. Mary at that time. One night I was sitting here and I wrote down all the shops that were there, starting from The Albert to the promenade there, and there were dozens of them, selling everything. There were probably about four selling meat, and those selling bread, and a few that sold vegetables. There was an attorney, and—who else was there? A man selling shoes. All things like that. They're not there now."
DQ_03.wav,,Ooilley ersooyl bunnys.,Almost all gone.
DQ_03.wav,,"As co-op nish, as yn shop to creck pabyryn.","And there's a co-op now, and the shop that sells papers."
DQ_03.wav,,As shen eh. Bunnys eh. S'bastagh shen. As cha nel agh un thie lhonney ayn nish. Yn Ablet hene.,"And that's it. Almost it. It's a shame, that. And there's only one pub now. The Albert itself."
DQ_03.wav,,"Bleeantyn er dy henney va mysh shiaght jeu ayn. The Perwick, Yn Ablet, The Point, The Bay, The Ballaqueeney, The Carrick, and The Station. Un faagit.","Years ago there were about seven of them. The Perwick, The Albert, The Point, The Bay, The Ballaqueeney, The Carrick, and The Station. One left."
DQ_03.wav,,As ram skibbyltee boghtey çheet dys yn phurt son y traaie as yn lhied.,And lots of tourists coming to the port for the beach and things.
DQ_03.wav,,Dy jarroo. Va shen yn aght ooilley mygeayrt y voayl.,Indeed. That was how it was all around the place.
DQ_03.wav,,Gyn dooyt erbee.,No doubt.
DQ_04.wav,,Mie lhiat goll magh shooyl monney er chor erbee?,Do you like going out walking at all?
DQ_04.wav,,"Oh, dy jarroo. Jesarn, 'syn oie my vees fastyr braew ayn, myr t'eh ayn ec y traa t'ayn, ta mee shooyl ooilley mygeayrt yn jiass ansherbee.","Oh, Indeed. Saturday, at night if it's a fine evening, as it is at the moment, I walk all around the south anyway."
DQ_04.wav,,As fastyr Jesarn as fastyr Jedoonee shooyl mygeayrt my vees yn emshir kiart. S'mie lhiam's jannoo shen.,And Saturday afternoon and Sunday afternoon walking about if the weather is right. I like doing that.
DQ_04.wav,,C'raad s'mie lhiat goll?,Where do you like to go?
DQ_04.wav,,"Well, Perwick. S'mie lhiam's Glen Chass as Perwick.","Well, Perwick. I like Glen Chass as Perwick."
DQ_04.wav,,"Ta Glen Chass ny boayl yindyssagh, nagh vel?","Glen Chass is a wonderful place, isn't it?"
DQ_04.wav,,"Oh, dy jarroo. T'eh dy jarroo.","Oh, Indeed. It is Indeed."
DQ_04.wav,,"Dy kinjagh Ã§heh ayns shen, eer 'sy geurey. My vees eh feayr ayns boayl erbee elley, ayns Glen Chass t'eh Ã§heh, nagh vel?","Always hot there, even in the winter. If it's cold everywhere else, in Glen Chass it's hot, isn't it?"
DQ_04.wav,,Ta chass ayn eer boayl erbee elley t'eh feayr as geayagh.,It's warm even when everywhere else is cold and windy.
DQ_04.wav,,Agh ayns Glen Chass t'eh kune as Ã§heh.,But in Glen Chass it's calm and hot.
DQ_04.wav,,"Agh er my hon's, son boayl dy chummal ayn, ta'n raad ro chionn, ro veg.","But for me, for a place to live, the road is too tight, too small."
DQ_04.wav,,"Ta mee toiggal. Oh aye, gyn dooyt erbee. Ta mee toiggal shen.","I understand. Oh aye, no doubt at all. I understand that."
DQ_04.wav,,As vel oo foast freayll calmaneyn as yn lhied?,And do you still keep pigeons and such?
DQ_04.wav,,"Oh, dy jarroo. Well, ta my ven jannoo yn obbyr shen.","Oh, Indeed. Well, my wife does that work."
DQ_04.wav,,"Oh, vel ee?","Oh, does she?"
DQ_04.wav,,Ta kuse jeu calmaneyn baney ayns shen. Ta mee er troggal thie daue ayns y gharey.,There are a few white doves there. I've built a house for them in the garden.
DQ_04.wav,,Ta shin lhiggey yn raad dauseyn dagh laa agh t'ad Ã§heet erash.,We let them go every day and they come back.
DQ_04.wav,,T'ad cliaghtit rish nyn dhie nish as t'ad ooilley Ã§heet erash geddyn nyn bee.,They are used to their house now and they all come back to get their food.
DQ_04.wav,,"R'ou rieau ratchal adsyn? R'ou rieau ratchal ny calmaneyn, t'ou toiggal?","Did you ever race them? Did you ever race the pigeons, you know?"
DQ_04.wav,,"Cha nel adsyn yn sorch. Yn sorch ta ain, ta calmaneyn baney t'ain.","They aren't the sort. The sort we have, they're white doves."
DQ_04.wav,,Cha nel adsyn son ratchal. T'ad ro litcheragh.,They don't race. They're too lazy.
DQ_04.wav,,"Kys ren oo goaill toshiaght freayll ny calmaneyn, ghooinney?","How did you start keeping the pigeons, man?"
DQ_04.wav,,"Well, hooar shin three piyr jeu veih eirinagh un keayrt.","Well, we got three pairs from a farmer one time."
DQ_04.wav,,"S'mie lesh my ven adsyn agh cha nel mee- well, t'ad kiart dy liooar.","My wife likes them but I'm now â€“ well, they're alright."
DQ_04.wav,,S'mie lesh my ven adsyn. Ta ish goit er ny calmaneyn. Agh t'ad jannoo dy mie.,My wife likes them. She's taken with pigeons. But they are doing well.
DQ_04.wav,,"Ta mysh, foddee, daeed jeu.","There are, probably, forty of them."
DQ_04.wav,,Daeed jeu?,Forty of them?
DQ_04.wav,,"Ta fer gorrym ny ghaa er geddyn stiagh, er lhiam's, er yn oyr cha nel ad ooilley bane.","A black fella or two has got in, I think, because they're not all white."
DQ_04.wav,,Cha nel ad ooilley bane nish?,They're not all white now?
DQ_04.wav,,"Ta dooinney ass Africa er geddyn stiagh ayns yn thie, er lhiam.","A fella from Africa has got into the house, I think."
DQ_04.wav,,Ta shen mie dy liooar.,That's not bad.
DQ_04.wav,,"Kanys ta reddyn mayrt's? Lesh y ghaelg, oo hene? T'ou jannoo dy mie, ta mee er chlashtyn. Gynsaghey yn Ghaelg, as roie mygeayrt.","How are things with you? With the Manx, yourself? You're doing well, I've heard. Teaching Manx, and running about."
DQ_04.wav,,"Well, roie mygeayrt, gyn dooyt erbee. Goll voish boayl dys boayl.","Well, running about, no doubt. Going from place to place."
DQ_04.wav,,But ta reddyn goll dy mie kyndagh rish yn chengey ec y traa t'ayn.,But things are going well with the language at the moment.
DQ_04.wav,,T'eh jannoo foays da my chree clashtyn oo hene gra dy vel ny paitchyn loayrt Gaelg nish.,I'm happy to hear you say that the kids are speaking Manx now.
DQ_04.wav,,Ta shen red yindyssagh.,That's a wonderful thing.
DQ_04.wav,,Kuse jeu loayrtee feer vie gyn dooyt erbee. Va shin ec y Vunscoill mee er dy henney as v'eh yindyssagh just loayrt rish ny paitchyn ayns Gaelg.,"Some of them very good speakers, without doubt. We were at the Bunscoill a month ago and it was wonderful just talking to the kids in Manx."
DQ_04.wav,,"As v'eh feer vie just clashtyn yn Gaelg goll er loayrt, as dy vel ram sleih ayn geearree nyn baitchyn goll dys y Vunscoill as y lhied.","And it's great just hearing Manx being spoken, and that lots of people want their kids to the Bunscoill and such."
DQ_04.wav,,So ta reddyn goll dy mie.,So things are going well.
DQ_04.wav,,Feer vie.,Very good.
DP_01.wav,,"Feer vie. Well laa braew grianagh t'ayn jiu, ghooinney.","Very good. Well it's a fine sunny day today, man."
DP_01.wav,,"Oh, nagh vel eh dy jarroo?","Oh, isn't it just?"
DP_01.wav,,Vel oo er ve gobbraghey ayns y gharey?,Have you been working in the garden?
DP_01.wav,,"Ta mee er ve gobbraghey feiy yn laa ayns y gharey, ghooinney, soie ooilley sorÃ§h dy reddyn.","I've been working all day in the garden, man, planting all sorts of things."
DP_01.wav,,As s'treisht lhiam dy bee yn emshyr ayn son shiaghtin ny ghaa ansherbee.,And I hope this weather will be in for a week or two anyway.
DP_01.wav,,"Well cha row eh cho mie jea. Hie mee dys Doolish jea, as ayns Doolish she laa braew grianagh v'ayn, t'ou toiggal, but tra haink mee erash dys Purt le Moirrey, myr sampleyr, va ram kay ayn.","Well it wasn't so good yesterday. I went to Douglas yesterday, and in Douglas it was a fine sunny day, you know, but when I came back to Port St. Mary, say, there was a lot of fog."
DP_01.wav,,"Kay, aye. Va kay agglagh ayn. V'eh ayn bunnys ooilley yn laa, ghooinney.","Fog, aye. There was terrible fog. It was in almost all day, man."
DP_01.wav,,S'bastagh shen.,"Shame, that."
DP_01.wav,,S'cummey mychione shen. Ta dy chooilley red gaase dy mie mannagh vel rio ayn.,It doesn't matter about that. Everything grows well if there's no frost.
DP_01.wav,,"T'eh jannoo dunverys da ooilley ny lossereeyn ayms. Agh booise da Jee, t'ad gaase.","It murders all my vegetables. But, thank God, they're growing."
DP_01.wav,,"Cha nel mee feer- well, cha nel garey ayms, t'ou toiggal.","I'm not very good- well, I don't have a garden, you know."
DP_01.wav,,Nagh vel?,You don't?
DP_01.wav,,"Cha nel, just patio ayms. Ta blaa ny ghaa ayn but cha nel mee feer vie son gobbraghey ayns y gharey. S'bastagh shen.","No, I just have a patio. There are a couple of flowers but I'm not very good at working in the garden. Shame."
DP_01.wav,,As quoi ta soie ny blaaghyn? Uss? Ny dty ven?,And who plants the flowers? You? Or your wife?
DP_01.wav,,Shen eh. T'ee feer vie.,That's it. She's very good.
DP_01.wav,,"Aye, shen yn aght, ghooinney.","Aye, that's the way, man."
DP_01.wav,,"Aye, shen yn aght.","Aye, that's the way."
