Filename,Speaker,Manx,English
DP_04.wav,,"Agh v'eh slane- ayns ny laghyn shen v'eh slane noi'n leigh dy gholl magh [shelg] er yn oie, t'ou toiggal.","But it was completely- in those days it was completely against the law to go out [hunting] in the night, you know."
DP_04.wav,,"As va shin goll magh, as kuse dy cheayrtyn va ny meoiryn shee geiyrt orrin, ghooinney, agh cha row shin rieau caillt.","And we went out, and a few times the police were chasing us, man, but we were never lost."
DP_04.wav,,"Cha row shin rieau goit, gow my leshtal.","We were never arrested, sorry."
DP_04.wav,,Goit ec ny meoiryn shee.,Arrested by the police.
DP_04.wav,,"Oddagh oo fakin ad cheet, fakin yn soilsheenyn [sic] cheet tessin ny magheryn as va shin roie ersooyl.","You could see them coming, see the lights coming over the fields and we would run away."
DP_04.wav,,As va mee cliaghtey goll er ny braddanyn neesht.,And I used to go after the salmon too.
DP_04.wav,,"Jannoo ymmyd jeh clep as loob. Ooilley mygeayrt yn ellan, ny awinyn.","Using a hook and loop. All around the Island, the rivers."
DP_04.wav,,"Er lhimmey jeh yn awin ec Sulby, yn Awin Stondane, as ny daa hawinyn ayns Doolish.","Except for the river at Sulby. The Santon Burn, and the two rivers in Douglas."
DP_04.wav,,Va ram braddan ayn ayns ny laghyn. Ram jeu.,There were lots of salmon in those days. Lots of them.
DP_04.wav,,Ta mee er n'akin ad ec ny easyn ayns Cronkbourne as er y droghad Poyl Roish neesht.,I've seen them at the waterfalls in Cronkbourne and at Pulrose bridge too.
DP_04.wav,,Ta mee er n'akin keeadyn jeu goll seose ny- kys t'ou gra waterfall? Eas.,I've seen hundreds of them going up the- how do you say waterfall? Eas.
DP_04.wav,,Eas.,Eas.
DP_04.wav,,"Easyn. Shen eh. Ta mee er n'akin keeadyn jeu, ghooinney.","Waterfalls. That's it. I've seen hundreds of them, man."
DP_04.wav,,Cha nel yn laa t'ayn jiu.,Not now.
DP_04.wav,,Cha nel. Ta kuse jeu foast ayn agh cha nel monney.,No. There are still a few but not many.
DP_04.wav,,"Ta mee er clashtyn dy vel kuse jeu er yn awin Neb, as Sulby neesht, agh Doolish, cha nel mee shickyr.","I've heard that there are a few in the river Neb, and Sulby too, but Douglas, I'm not sure."
DP_04.wav,,"Ta ram stoo cheet seose yn awin woish, well, er lhiam's woish ny gowaltyssyn.","A lot of stuff comes down the river from, well, I think from the farms."
DP_04.wav,,"Woish ooilley ny kemmigyn t'ad jannoo ymmyd jeh, as t'ad er chur baaase da ny braddan beg.","From all the chemicals they use, and they've killed the young salmon."
DP_04.wav,,Cuin v'ou goll magh er yn vraddan shen? Feed blein er dy henney? Foddey na shen?,When were you going after salmon? Twenty years ago? Longer than that?
DP_04.wav,,Tra va mee my ghooinney aeg.,When I was a young man.
DP_04.wav,,"Shen just feed blein er dy henney, ghooinney.","That's just twenty years ago, man."
DP_04.wav,,Gura mie mooar ayd!,Thanks very much!
DP_05.wav,,As cre mychione goll er yn eeastagh? Row oo rieau goll er yn cheayn?,And what about fishing? Were you ever at sea?
DP_05.wav,,"Oh, va. Va mee cliaghtey goll er y cheayn.","Oh, yeah. I used to go to sea."
DP_05.wav,,"Cha row shin goll magh lesh lieenteenyn, just lesh slatt as rimlagh, t'ou toiggal.","We didn't go out with nets, just with a rod and line, you know."
DP_05.wav,,Va ooilley sorch dy eeast ain ry-gheddyn.,We'd get all sorts of fish.
DP_05.wav,,"Ayns y valley, Balley Cashtal, va callig ayn, as boddagh, as brick marrey, as eer skarrag.","In the town, Castletown, there were pollack, and cod, and mackerel, and even skate."
DP_05.wav,,"Cha nel ayns y vaaie Balley Cashtal ayns baaie, kys t'ou gra, Stondane.","Not in Castletown bay, in, how do you say, Santon."
DP_05.wav,,Faggys da Port Grenaugh. Noi Port Grenaugh ta boayl mie son geddyn skarrag.,Near Port Grenaugh. By Port Grenaugh is a good place for getting skate.
DP_05.wav,,As skeddan neesht.,And herring.
DP_05.wav,,"S'cooin lhiam, oie dy row, va mish as three caarjyn, va shin er baatey, as haink shin er breck marrey, as erskyn ny breck marrey va skeddan ayn, as cha dod oo goll trooid ny neesht jeu.","I remember, one night, me and three friends, we were on a boat, and we came upon some mackerel, and above the mackerel were herrings, and you couldn't go through the both of them."
DP_05.wav,,"Va keeadyn jeu cheet magh ass, as dooyrt mee da my chaarjyn, 'Scuirr, caarjyn. T'ou goll ass dty cheeal, ghooinney.'","Hundreds of them were coming out, and I said to my friends, 'Stop, mates. You're going mad, man.'"
DP_05.wav,,Va kishtagyn lhome lane dy skeddan as breck marrey ain.,We had boxes full of mackerel and herrings.
DP_05.wav,,"As va shin magh er y cheayn fud ny h-oie, as tra haink shin erash er y nah voghrey","And we were out on the sea all night, and when we came back the next morning"
DP_05.wav,,"va shin goll mygeayrt ny thieyn prowal geddyn rey rish ooilley yn eeast, ghooinney.","we went all around the houses trying to get rid of all the fish, man."
DP_05.wav,,"As ec y jerrey daag shin ad cheu mooie yn thie oast yn Phott Glue,","And in the end we left them outside The Glue Pot,"
DP_05.wav,,as va'n sleih cheet magh ass as v'ad geddyn meeryn dy phabyr as v'ad cur ad as v'ad prowal dy geddyn thie.,and people were coming out and getting a piece of paper and putting them in it and trying to get them home.
DP_05.wav,,V'ad lieh meshtit goll seose yn traid.,They were half drunk going down the street.
DP_05.wav,,Agh cha nel mee er ve er y cheayn rish daa ny three bleeantyn nish.,But I haven't been on the sea for several years now.
DP_05.wav,,Row baatey ayd?,Did you have a boat?
DP_05.wav,,Cha nel baatey aym's.,I don't have a boat.
DP_05.wav,,"Va baatey ec my charrey agh ta eshyn geddyn shenn nish as cha nel eh son goll magh feer vennick, t'ou toiggal.","My friend had a boat but he is getting old now and he doesn't go out very often, you know."
DP_05.wav,,As cha nel yn emshir er ve feer vie son daa ny three bleeantyn nish son goll magh. Laa ny ghaa.,And the weather hasn't been very good for going out for a few years now. A few days.
DP_05.wav,,As traa ta'n emshir mie cha nel yn tidey kiart.,And when the weather is good the tide isn't right.
DP_05.wav,,Agh ta ram obbyr ry-yannoo aym's mygeayrt y hie aynsherbee.,But I have a lot of work to do around the house anyway.
DP_05.wav,,Vel oo goll dys Doolish monney?,Do you go to Douglas much?
DP_05.wav,,Cha nel. Cha nel mee coontey monney jeh Doolish.,No. I don't think much of Douglas.
DP_05.wav,,Ta ooilley ny bloody riftanee beaghey ayns shen.,All the bloody scallies live there.
DP_05.wav,,Nagh vel ad cummal ayns Balley Cashtal? Smooinnee mee dy row.,Don't they live in Castletown? I thought they did.
DP_05.wav,,"Foddee dy row uss er ve geaishtagh rish breagyn, ghooinney.","Maybe you have been listening to lies, man."
DP_05.wav,,Foddee dy vel.,Maybe.
DP_05.wav,,Agh ta kuse dy riftanyn ayn agh cha nel cho monney as Doolish.,But there are a few scallies but not as many as Douglas.
DP_05.wav,,Gyn dooyt erbee.,Definitely.
DP_05.wav,,Ta ooilley druggaghyn as yn lheid ayns Doolish.,There's all drugs and the like in Douglas.
DP_05.wav,,Va boirey kuse dy vleeantyn er dy henney.,There was a problem a few years ago.
DP_05.wav,,"Va boirey ayn bentyn rish druggaghyn ayns Balley Cashtal, agh booise da Jee ta dy meoiryn shee er geddyn greim orroo","There was a problem with drugs in Castletown, but thank God, the police have arrested them"
DP_05.wav,,as ta bunnys ooilley eer ayns prysoon ny ersooyl veih yn Ellan.,and they're almost all either in prison or off the Island.
DP_05.wav,,Cha nel monney boirey ain bentyn rish yn lheid myr shen nish ansherbee.,There's not much of a problem with drugs and the like now anyway.
DP_05.wav,,As vel oo goll ersooyl monney er laghyn seyrey?,And do you go away on holiday much?
DP_05.wav,,"Oh, she. Foddee daa cheayrt 'sy vlein.","Oh, yeah. Maybe twice a year."
DP_05.wav,,"B'vie lhien goll- well, foddee gys kione shiaghtin ayns Sostyn.","We like to goâ€”well, maybe for a weekend in England."
DP_05.wav,,"S'mie my charrey goll mygeayrt ny shappyn, t'ou toiggal.","My friend likes to go around the shops, you know."
DP_05.wav,,As nagh mie lhiat?,And don't you like to?
DP_05.wav,,"T'eh kiart dy liooar son lieh laa foddee, agh lurg shen ta mee gra, 'Well, ersooyl lhiat er ny chappyn as beeym ayns thie oast ennagh.'","It's alright for half a day maybe, but after that I say, 'Well, go off to the shops and I'll be in a pub.'"
DP_05.wav,,Lieh yn phabyr as geddyn braghtan as pint. T'eh kiart dy liooar.,Reading the paper and having a sandwich and a pint. It's alright.
DP_05.wav,,"As eisht, s'mie lhien goll gys yn Idaal, gys y twoaie, er ny loghyn, t'ou toiggal.","And then, we like to go to Italy, to the north, to the lakes, you know."
DP_05.wav,,Ayns ny sleityn. Ta shinyn er ve gys bunnys ooilley ny loghyn nish.,In the mountains. We've been to almost all the lakes now.
DP_05.wav,,"Trasimeno, as Como, as Garda, as fer elley. Cha nel mee shickyr yn ennym er.","Trasimeno, and Como, and Garda, and another one. I'm not sure what it's called."
DP_05.wav,,"Cha nel eh cho cheh as yn jiass, t'ou toiggal.","It's not as hot as the south, you know."
DP_05.wav,,T'eh ro heh er my hon ayns y jiass.,It's too hot for me in the south.
DP_05.wav,,Ta mee er ve gys Naples as- ta ellan ayn ayns yn baaie shen enmyssit Capri?,I've been to Naples andâ€”there's an island in the bay there called Capri?
DP_05.wav,,"Oh, ta mee er ve gys Capri, as ta ellan elley ayn.","Oh, I've been to Capri, and there's another Island."
DP_05.wav,,T'eh jarroodit.,I've forgotten.
DP_05.wav,,"Va shin tannaghtyn ayns- oh, shee bannee mee, ta'n ennym ersooyl voym.","We were staying inâ€”oh, God bless me, I've forgotten the name."
DP_05.wav,,C'red ta'n ennym?,What's the name?
DP_05.wav,,"Cha nel eh feer foddey woish Pompei, as Herculaneum.","It's not very far from Pompeii, and Herculaneum."
DP_05.wav,,Cha row mee rieau ayn.,I've never been there.
DP_05.wav,,T'eh just mygeayrt y vaaie.,It's just around the bay.
DP_05.wav,,She boayl mooar v'eh. Mie nhione da dy chooilley sleih.,It was a big place. Everyone knows it.
DP_06.wav,,S'mie lhiat goll gys yn Idaal.,You like to go to Italy.
DP_06.wav,,"S'mie lhiam y voayl shen. S'mie lhiam yn sleih neesht. T'ad gra ayns Baarle, 'laid back.'","I like it there. I like the people too. They say in English, 'laid back.'"
DP_06.wav,,As s'mie lhiam yn bee ayns shen.,And I like the food there.
DP_06.wav,,"Oh, mie lhiat yn bee?","Oh, you like the food?"
DP_06.wav,,"Oh, s'yindyssagh. Foddee dy vel mee feer aaghoil. Foddym gee red ennagh, t'ou toiggal.","Oh, it's wonderful. Maybe I'm very relaxed. I will eat anything, you know."
DP_06.wav,,Ta mee toiggal.,I understand.
DP_06.wav,,As s'mie lhiam pasta.,And I like pasta.
DP_06.wav,,"Oh, mie lhiat?","Oh, you do?"
DP_06.wav,,As ooilley yn stoo- ooilley sorch dy awree t'ad cur er. As yn caashey neesht. S'yindyssagh eh.,And all the stuffâ€”all the types of sauce they put on it. And the cheese too. It's wonderful.
DP_06.wav,,Ta mee gaase accryssagh smooinaghtyn my-e-kione.,I'm getting hungry thinking about it.
DP_06.wav,,Scuirr nish! Mie dy liooar.,Stop now! OK.
DP_06.wav,,As yn feeyn neesht. S'feeyn yindyssagh ayns shen.,And the wine too. It's wonderful wine there.
DP_06.wav,,"T'ou feer sophisticated, ghooinney, uss. Gee bee Idaalagh, giu feeyn.","You're very sophisticated, man. Eating Italian food, drinking wine."
DP_06.wav,,"Cha jinnin gra shen, ghooinney, agh ta fys aym cre mie lhiam, ghooinney.","I wouldn't say that, man, but I know what I like, man."
DP_06.wav,,Ta mee toiggal.,I understand.
DP_06.wav,,Red ennagh. Jiarg ny bane. S'cummey.,Anything. Red or white. It doesn't matter.
DP_06.wav,,S'cummey. Cha nel mee son giu feeyn son yn chooid smoo.,It doesn't matter. I don't really drink wine usually.
DP_06.wav,,"Oh, s'mie lhiam eh. S'yindyssagh.","Oh, I like it. It's wonderful."
DP_06.wav,,Beggan feeyn bane but shen ooilley ansherbee.,A little white wine but that's it anyway.
DP_06.wav,,Cha nel mee coontey monney jeh'n lhune ayns shen. T'eh ooilley lane dy gas. Stoo agglagh.,I don't think much of the beer there. It's all full of gas. Awful stuff.
DP_06.wav,,T'eh gollrish lager as cha nel mee coontey monney jeh lager.,It's like lager and I don't like lager.
DP_06.wav,,Mish noadyr.,Me neither.
DP_06.wav,,"Ta mee slane son yn lhune, t'ou toiggal.","I'm all for the ale, you understand."
DP_06.wav,,Ta mee toiggal.,I understand.
DP_06.wav,,Vel oo goll dy nherin er chor erbee er laghyn seyrey?,Do you go to Ireland on holiday at all?
DP_06.wav,,"Well, va mee cliaghtey goll gys Nherin er yn oyr va mee poost rish ben veih Nherin.","Well, I used to go to Ireland because I was married to a woman from Ireland."
DP_06.wav,,"Veih yn twoaie, t'ou toiggal. Veih yn County Down.","From the north, you know. From County Down."
DP_06.wav,,"Ta mee er ve gys yn jiass un keayrt, er lhiam's.","I've been to the south once, I think."
DP_06.wav,,Shen ooilley. Hie shin gys Divlyn.,That's all. We went to Dublin.
DP_06.wav,,As va shin ayns shen son sorch dy kione shiaghtin liauyr.,And we were there for a sort of long weekend.
DP_06.wav,,As hie shin er turrys mygeayrt ny sleityn Wicklow er sorch dy varroose.,And we went on a tour around the Wicklow mountains on a sort of bus.
DP_06.wav,,Va shen ooilley.,That was all.
DP_06.wav,,Agh ta mee er ve mygeayrt yn twoaie kuse dy cheayrtyn.,But I've been around the north a few times.
DP_06.wav,,Va mee sooree- va mee cliaghtey goll gys shen bunnys daa ny three keayrtyn dagh vee.,I was courtingâ€”I used to go there almost two or three times a month.
DP_06.wav,,As cha row eh cho costallagh ayns ny laghyn shen.,And it wasn't as costly in those days.
DP_06.wav,,"Shen goll er y vaatey, foddee.","Going on the boat, probably."
DP_06.wav,,Er y vaatey as er yn etlan neesht.,On the boat and on the plane too.
DP_06.wav,,S'bastagh nagh vel ny baatyn goll feer vennick gys Nherin nish.,It's a shame the boats don't go very frequently to Ireland.
DP_06.wav,,"S'bastagh. Ta mee ayns cordail rish, ghooinney.","It's a shame. I agree, man."
DP_06.wav,,"Agh ayns ny laghyn shen va'n boirey, va'n 'Boirey' just goaill toshiaght, t'ou toiggal.","In those days the trouble, the 'Troubles' were just starting, you understand."
DP_06.wav,,Ta mee toiggal.,I understand.
DP_06.wav,,"Agh cha nel mee er ve gys shen son foddee feed, ny ny smoo na feed, blein, ghooinney.","But I haven't been there for probably twenty, or more than twenty, years, man."
DP_06.wav,,Agh s'mie lhiam Nalbin neesht.,But I like Scotland too.
DP_06.wav,,Ta Linda as mish er ve gys-turryssagh ayns gleashtan.,Linda and me have been touring in a car.
DP_06.wav,,"Hie mee gys shen marish Ritchie Radlagh, yn kied keayrt va mee ayns shen.","I went there with Ritchie Radcliffe, the first time I was there."
DP_06.wav,,"Dimmee shin woish Fleetwood, er lhiam's.","We went from Fleetwood, I think."
DP_06.wav,,Woish Fleetwood gys Ellan y Cheo.,From Fleetwood to the Isle of Skye.
DP_06.wav,,"As hie shin tessin y cheyllys er shenn baatey, veih Logh Alsh gys Eillean a Cheo, or Ellan Skianagh, t'ad gra.","And we went over the sound in an old boat, from Loch Alsh to the Isle of Mist, or the Isle of Skye, they call it."
DP_06.wav,,"Dy gheaistagh rish y Gallic, t'ou toiggal.","To listen to Gallic, you know."
DP_06.wav,,As cha row monney Gallic ry-clashtyn.,And there wasn't much Gallic to be heard.
DP_06.wav,,Va kuse dy leih. S'quaagh.,There were a few people. It's strange.
DP_06.wav,,"Tra va Linda as mish ayn, blein ny ghaa er dy henney,","When me and Linda were there, a few years ago,"
DP_06.wav,,"va shin tannaghtyn ayns boayl enmyssit Broadford, ayns thie aaght ayns shen.","we were staying in a place called Broadford, in a guest house there."
DP_06.wav,,"As va ben ayn, as dagh voghrey, choud's va shin geddyn nyn mrishey trostey,","And there was a woman there, and every morning, while we were having our breakfast,"
DP_06.wav,,v'ee geaishtagh rish yn claare gaelgagh er y radio.,she would listen to a Gallic programme on the radio.
DP_06.wav,,"As dooyrt me da Linda, 'Shegin d'ou briaght jeh'n ven vel ee toiggal yn Gaelg.'","And I said to Linda, 'I must ask that woman if she understands Gallic.'"
DP_06.wav,,"As ansherbee, vrie mee j'ee 'My leshtal, doodee. Vel oo toiggal yn Gaelg?'","And anyway, I asked her, 'Excuse me, gal. Do you understand Gallic?'"
DP_06.wav,,"As dooyrt ee, 'Oh, cha nel mee. Cha nel fockle erbee.' dooyrt ee.","And she said, 'Oh, no I don't. Not a word,' she said."
DP_06.wav,,"S'quaagh, er yn oyr v'ee geaishtagh rish dagh voghrey, as cha row ee son gra monney.","It's strange, because she was listening every morning, and she didn't say much."
DP_06.wav,,"As ren shin feddyn, choud's va shin goll mygeayrt yn ellan, va shin feddyn lheid myr shen, ghooinney.","And we found, as we were going around the Island, we found it like that, man."
DP_06.wav,,"V'ou goll stiagh 'sy thie oast as bee ad loayrt ass y Gallic, as tra cheayll shinyn loayrt ass y vaarle v'ad scuirr as brishey stiagh ayns Baarle.","You would go into a pub and they would be speaking in Gallic, and when they heard us speaking in English they would stop and break into English."
DP_06.wav,,"S'quaagh, nagh row?","Strange, wasn't it?"
DP_06.wav,,"As va mee smooinaghtyn, 'Foddee dy row shinyn myr shen keead bleeantyn er dy henney.'","And I was thinking, 'We were probably like that a hundred years ago.'"
DP_06.wav,,"Oh, gyn dooyt erbee. Skeeal cadjin.","Oh, no doubt. A common story."
DP_06.wav,,"Va shin, cha nel fockle aym ayns Gaelg, ashamed, foddee.","We were, I don't have the word in Manx, ashamed, perhaps."
DP_06.wav,,Nearey.,Nearey.
DP_06.wav,,"Nearey, aye. Goaill nearey. Foddee dy row shin goaill nearey jeh'n chengey ain, ghooinney.","Nearey. That's it. Ashamed. We were probably ashamed of our language, man."
DP_06.wav,,"S'bastagh, ghooinney.","It's a shame, man."
DP_06.wav,,Shen yn aght.,That's the way.
DP_06.wav,,"Agh tra va Ritchie as mish ayn, va kuse dy chaarjyn ec Ritchie, t'ou toiggal, as Gallic ocsyn neesht,","But when Ritchie and me were there, Ritchie had a few friends, you know, who spoke Gallic too,"
DP_06.wav,,"as va shin 'sy thie oast ayns Dunvegan as hiank shin nyn guaiyl caarjyn Ritchie,","and we were in the pub in Dunvegan, and we met Ritchie's friends,"
DP_06.wav,,"as va nene jeu gobbraghey cooyl y var, as va fer elley, v'eh just ny hassoo ec y var,","and one of them was working behind the bar, and another one, he was just standing at the bar,"
DP_06.wav,,"as tra haink Ritchie as mish stiagh dooyrt eh, 'Ta Ritchie woish Ellan Vannin.' as 'Quoi ta uss?'","and when Ritchie and me came in he said, 'It's Ritchie from the Isle of Man.' and 'Who are you?'"
DP_06.wav,,"As ansherbee, dooyrt mee, 'Ta mee enmyssit Derek- ta'n ennym orrym Derek.'","And anyway, I said, 'I'm called Derek. My name is Derek.'"
DP_06.wav,,"As ansherbee, 'Cre b'vie lhiat dy yough?'","And anyway, 'What would you like to drink?'"
DP_06.wav,,"As dooyrt Ritchie, 'Lager and lime, my saillt.'","And Ritchie said, 'Lager and lime, please.'"
DP_06.wav,,"As ren yn fer gra da'n fer cooyl y var, 'Lager as eayl.'","And the man said to the man behind the bar, 'Lager as eayl.'"
DP_06.wav,,"Eayl? Ta shen Lime, nagh vel?","Eayl? That's 'lime', isn't it?"
DP_06.wav,,Shen eh.,That's it.
DP_06.wav,,'Lager as eayl.' dooyrt eh.,"'Lager and lime,' he said."
DP_06.wav,,As va eshyn ginsh dooin- c'red va'n ennym urree? Hughie.,And he was telling usâ€”what was her name? Hughie.
DP_06.wav,,She eeasteyr v'eh.,He was a fisherman.
DP_06.wav,,As dooyrt Hughie dy row ad goaill nearey jeh'n chengey oc.,And Hughie said that they were ashamed of their language.
DP_06.wav,,"Hughie McKinnon, va shen yn ennym urree, yn ennym er, gow my leshtal.","Hughie McKinnon, that was her name, his name, sorry."
DP_06.wav,,Dooiney agglagh v'eh.,"An awful man, he was."
DP_06.wav,,V'eh gaccan yn slane laa mychione yn 'we free'.,He would complain the whole day about the 'we free.'
DP_06.wav,,Va'n agglish yn 'wee free'.,The church was the 'wee free.'
DP_06.wav,,Ta mee toiggal shen.,I understand that.
DP_06.wav,,"Dooyrt eh, 'T'ad buggeryn shen.' dooyrt eh.","He said, 'They're buggers, them,' he said."
DP_06.wav,,"'T'ad noi dy chooilley red. T'ad noi yn jough, t'ad noi yn cinema, t'ad noi eer garaghtee, ghooinney.'","'They are against everything. They're against drink, they're against the cinema, they're even against laughing, man.'"
DP_06.wav,,Shen eh.,That's it.
DP_06.wav,,Ta shin er ve turrys ooilley mygeayrt yn-,We have been all around theâ€”
DP_06.wav,,"Well, va Gallic dy liooar ec Richard, nagh row?","Well, Ritchie spoke a bit of Gallic, didn't he?"
DP_06.wav,,"Oh, va. Va Gallic echey.","Oh, yes. He spoke Gallic."
DP_06.wav,,As ec Davey Quillin neesht.,And Davey Quillin too.
DP_06.wav,,Ta eshyn lhome lane jeh.,He's full of it.
DP_06.wav,,"Agh, ta mee er phrowal eh, agh cha noddyms geddyn greim, ghooinney.","But, I've tried it, but I can't get a hold of it, man."
DP_06.wav,,Ta beggan ro ghoillee er my hon's.,It's a bit too difficult for me.
DP_06.wav,,T'eh ro ghoillee er my hon.,It's too difficult for me.
DP_06.wav,,"Ta'n Gaelg doillee dy liooar er my hon's, er lhiam's.","Manx is difficult enough for me, I think."
DP_06.wav,,"Tra t'ou prowal lhaih eh, t'eh jannoo...","When you try to read it, it makes..."
DP_06.wav,,"Ta, ta mee toiggal. Share lhiam Gaelg, gyn dooyt erbee.","Yeah, I understand. I prefer Manx, definitely."
DP_06.wav,,"Agh, s'cummey.","But, it doesn't matter."
DP_07.wav,,"Ta mee just clashtyn ny budgies, ghooinney.","I'm just hearing the budgies, man."
DP_07.wav,,Ta fer er y nah ghorrys aym's. Ta eshyn freayll canaareeyn.,There's a man next door. He keeps canaries.
DP_07.wav,,"As t'ad goll er feiy'n laa, ghooinney. T'ad twitteral feiy'n laa. S'yindyssagh t'ad.","And they go all day, man. They twitter all day. They're wonderful."
DP_07.wav,,Eer 'sy yeurey t'ad jannoo yn lheid.,Even in the winter they do it.
DP_07.wav,,Cre'n sorch obbyr vees ayd jiu? Vel monney obbyr ry-yannoo?,What sort of work will you do today? Is there much work to do?
DP_07.wav,,"Well, booise da Jee, cha nel nish.","Well, thank God, not now."
DP_07.wav,,"Ren mee soie my lossyn thie, ren mee soie ad, as va shen yn jerrey jeh.","I planted my lossyn thie, I planted them, and that was the end of it."
DP_07.wav,,"Ta dy chooilley red, ta pishyryn ayn, lussyn thie, praase, carradjeyn.","There's everything, there's peas, lussyn thie, potatoes, carrots."
DP_07.wav,,Unnishyn mleeaney? Cha nel unnishyn mleeaney.,Onions this year? No onions this year.
DP_07.wav,,Cre ta'n fockle son cauliflower?,What's the word for cauliflower?
DP_07.wav,,"Ta adsyn ayn, as three horch dy poanraghyn. Three horch.","There are those, and three sorts of beans. Three sorts."
DP_07.wav,,"Poanraghyn ta drappal, poanraghyn veih'n Rank, t'ad gra, as poanraghyn lhearey?","Runner beans, French beans, they call them, and lhearey beans."
DP_07.wav,,"Ta shen broad, vel?","That's broad, is it?"
DP_07.wav,,"Oh, lhean.","Oh, lhean."
DP_07.wav,,"Lhean. Poanraghyn lhean. Broad beans, t'ad gra.","Lhean. Poanraghyn lhean. Broad beans, they say."
DP_07.wav,,As ooyllyn graih.,And tomatoes.
DP_07.wav,,Oh shee bannee mee.,Oh wow.
DP_07.wav,,"Ta keeadyn jeu heose ny greeishyn, ghooinney. Feer vie.","There are hundreds of them upstairs, man. Very good."
DP_07.wav,,"Nish ta ny paitchyn ersooyl veih yn thie ta daa hamyr nish ayn,","Now that the kids are out of the house there are two rooms,"
DP_07.wav,,as ta mee er cur buird fo ny uinnagyn as ta ooilley ny pottyn soit ayns ny uinnagyn.,and I've put boards under the windows and all the pots are sitting in the windows.
DP_07.wav,,Ta cottage industry ayn.,It's a cottage industry.
DP_07.wav,,As va fer ayn gobbraghey da'n reiltys. Cre'n fockle t'ou jannoo ymmyd jeh son commissioners?,And there was a fella working for the government. What word do you use for 'commissioners?'
DP_07.wav,,Barrantee.,Barrantee.
DP_07.wav,,"Barrantee. T'eh gobbraghey da'n barrantee,","Barrantee. He works for the commissioners,"
DP_07.wav,,"as va mee ayns feme jeh uinnag noa, as ansherbee haink eh da'n thie aym's dy cur stiagh yn uinnag noa,","and I needed a new window, and anyway he came to my house to put in the new window,"
DP_07.wav,,"as dooyrt eh, tra honnick eh ooilley ny ooyllyn graih gaase,","and he said, when he saw all the tomatoes growing,"
DP_07.wav,,"as cha row ad my-vlaa, va just duillagyn ayn,","and they weren't in flower, there were just leaves,"
DP_07.wav,,"as dooyrt eh, 'Cha nel oo gaase yn kennip, ghooinney?'","and he said, 'You're not growing cannabis, man?'"
DP_07.wav,,Ooyllyn graih.,Tomatoes.
DP_07.wav,,"She ooyllyn graih t'ad, ghooinney.","'They're tomatoes, man.'"
DP_07.wav,,"Dooyrt eh, 'Vel oo shickyr?'","He said, 'Are you sure?'"
DP_07.wav,,"'Ta mee shickyr, ghooinney.'","'I'm sure, man.'"
DP_07.wav,,"As choud's t'ad just goaill toshiaght gaase, myr t'ad cho ard as shen, t'ad jeeaghyn myr marijuana, ghooinney.","And as they are just starting to grow, as they're as high as that, they look like marijuana, man."
DP_07.wav,,Vel?,Do they?
DP_07.wav,,"Ta mee er n'akin- un keayrt va mee ayns Amsterdam, as just goll mygeayrt ny shappyn,","I've seen—once I was in Amsterdam, and just going around the shops,"
DP_07.wav,,"as va sorch dy caffeeyn ayn, caffee café, as va mee jeeaghyn,","and there were sort of cafés there, coffee houses, and I was looking,"
DP_07.wav,,"as ayns dagh uinnag va pot as red ennagh gaase ayn,","and in every window there was a pot with something growing in it,"
DP_07.wav,,"as dooyrt mee da'n Linda, 'Cre'n sorch dy...?'","and I said to Linda, 'What sort of...?'"
DP_07.wav,,"As dooyrt ee, 'Shen bloody marijuana!' t'ou toiggal.","And she said, 'That's bloody marijuana!' you know."
DP_07.wav,,"Cha nee ooyllyn graih, ghooinney.","Not tomatoes, man."
DP_07.wav,,"Oh, cha nee. As va keeadyn jeu ayn.","Oh, no. And there were hundreds of them."
