Filename,Manx,English
DP_03,"As dooyrt mee, 'Shen agglagh.' As ayns ny laghyn shen cha row fys aym dy row eer yn chengey ayn, as dooyrt mee roie, va mee just goaill toshiaght gynsaghey, as va shen y resoon, foddee, dy ghow mee toshiaght er y Ghaelg.","And I said, 'That's terrible.' And in those days I didn't even know the language existed, and I said before, I was just starting to learn, and that's the reason, probably, that I started with Manx."
DP_03,"As va mee ec y colleish son tree bleeantyn, er lhiam's, as haink mee ny whaiyl Ritchie Radlagh.","And I was at the college for three years, I think, and I met Ritchie Radcliffe."
DP_03,"As va Ritchie beaghey ayns Balley Cashtal, t'ou toiggal, as hug eh cuirrey dou dy heet gys yn thie echey.","And Ritchie was living in Castletown, you know, and he invited me to go to his house."
DP_03,"As ren mee shen, as hooar mee bunnys ooilley yn Ghaelg aym's veih Ritchie. She gaelgeyr yindyssagh v'eh.","And I did that, and I got almost all my Manx from Ritchie. He was a wonderful Manx speaker."
DP_03,As row enney eu hene er?,And did you know him yourself?
DP_03,"Oh aye, yeah.","Oh aye, yeah."
DP_03,"Oh, dy jarroo. Va shiuish cliaghtey cheet gys Yn Lhong. V'eh jarroodit aym's. Uss as Phillie.","Oh, of course. You used to come to The Ship. I forgot. You and Phillie."
DP_03,"Va mee goll dys thie yn dooinney hene ayns Colby, sy tourey.","I used to go to his house in Colby, in the summer."
DP_03,Shen eh. Tra haink eh dy ve ny haaue hie eh gys- Shen eh. Ec yn traa shen row ec gobbraghey ec yn vank ayns Balley Cashtal?,That's it. When he came to be retired he went to- That's it. At the time was he working in the bank in Castletown?
DP_03,"V'eh. Well, cha row ayns Balley Cashtal, ayns Purt Chiarn.","He was. Well, not in Castletown, in Port Erin."
DP_03,"Oh, right. Shen kiart.",Oh right. That's right.
DP_03,V'eh gobbraghey- er lhiam's dy ghow eh toshiaght ayns Balley Cashtal agh haink eh dy ve yn ard ghooinney ayns Purt Chiarn. V'eh. As v'eh ayns shen. Agh cha daink eh veih Balley Cashtal. V'eh ruggit as troggit ayns Rhumsaa.,He worked- I think he started in Castletown but he came to be the manager in Port Erin. Yeah. And he was there. But he didn't come from Castletown. He was born and raised in Ramsey.
DP_03,Shen kiart.,That's right.
DP_03,"She. Va blass yindyssagh ec Ritchie. Ta mish loayrt dy tappee, as er lhiam's, ec keayrtyn, ta mee loayrt ro tappee, t'ou toiggal.","Yeah. He had a wonderful accent, Ritchie. I speak quickly, and I think, at times, I speak too quickly, you know."
DP_03,"Agh va Ritchie, v'eh loayrt dy moal, as v'eh just goll er as goll er. Dinsee eh ram dooys.","But Ritchie, he spoke slowly, and he just went on, and went on. He taught me a lot."
DP_03,V'eh toiggal yn chengey feer vie gyn dooyt erbee.,"He understood the language very well, without doubt."
DP_03,Nagh row eh dy jarroo.,Didn't he indeed.
DP_03,Ren mee recortey eshyn kuse dy vleeantyn er dy henney.,I recorded him a few years ago.
DP_03,"Oh, ren oo? Oh, yindyssagh.","Oh, did you? Oh, wonderful."
DP_03,Va shin lhaih magh ass y vible as stoo elley. So ta recortyssyn aym's.,We were reading from the bible and other stuff. So I have recordings.
DP_03,"Well, b'vie lhiam clashtyn.","Well, I would like to hear."
DP_03,Ta kuse jeu er learnmanx.com. Ta nane jeu as eshyn lhaih magh skeeal mychione foayr.,A few of them are on learnmanx.com. There's one of them where he is reading out a story about a giant.
DP_03,Oh vel? Er yn eddyr voggyl?,Oh are they? On the internet?
DP_03,"Yeah, er yn eddyr voggyl.","Yeah, on the internet."
DP_03,Dy jarroo.,Indeed.
DP_03,Neeym- Verym dhyt ooilley ny recortyssyn. Eshyn lhaih magh ass yn vible son yn chooid smoo. Er lhiam dy ren eshyn geddyn yn Gaelg echey woish yn vible son yn chooid smoo.,I will- I'll give you all the recordings. Him reading from the bible for the most part. I think he got his Manx from the bible for the most part.
DP_03,"Dooyrt eh shen dou. Tra va'n caggey ayn as va eshyn sy lhuingys reeoil, as she gunneyder v'eh.","He told me that. When the war was on and he was in the royal navy, and he was a gunner."
DP_03,"As va bible Gaelg echey, as va bible Baarle echey, as v'eh lhaih ny neesht jeu ry cheilley. As shen yn aght dy dinsee eh hene y Gaelg.","And he had a Manx bible, and an English bible, and he would read them both together. And that's how he taught himself Manx."
DP_03,Shen feer vie [son] gynsaghey Gaelg.,That's very good [for] learning Manx.
DP_03,"As eisht hie eh gys brastyl ny ghaa, er lhiam's. Lheid myr Leslie Quirk, as Doolish â€“ 'Breagagh' â€“ as, oh, quoi elley v'ayn ayns ny laghyn shen?","And then he went to a class or two, I think. Like of Leslie Quirk, and Douglas â€“ 'Liar' â€“ and, oh, who else was there in those days?"
DP_03,Yn dooinney mooar veih'n twoaie wooar.,The big fella from the far north.
DP_03,Juan Crellin?,Juan Crellin?
DP_03,"Oh, s'cummey ansherbee. As va fer- Walter Clarke! Walter, as Craayl veih Balley Curree. Va dy chooilley jeu ayn.","Oh, it doesn't matter anyway. And there was a man- Walter Clarke! Walter, and Kneale from Ballacurry. They were all there."
DP_03,Cha row mee shickyr my hie Ritchie mygeayrt jannoo recoyrtyssyn woish ny shenn ghaelgeyryn.,I'm not sure if Ritchie went about making recordings of the old Manx speakers.
DP_03,"Yeah, er lhiam nagh ren eh shen.","Yeah, I don't think he did that."
DP_03,"Va shen braaraghyn Braid, er lhiam's. Mark as Tom. As Walter Clarke neesht. As va adsyn goll mygeayrt jannoo recoyrtyssyn.","That was the Braid brothers, I think. Mark and Tom. And Walter Clarke, too. And they were going about making recordings."
DP_03,S'quaagh. Ta ooilley ny tapeyn aym's.,It's strange. I have all the tapes.
DP_03,Vel?,Do you?
DP_03,Ta. Cha nel mee shickyr cre'n aght haink ad dooys. T'ad foast ny lhie heose ny greeishyn. As ta greie ayn neesht dy cloie ad. Shen greie.,Yeah. I'm not sure how they came to me. They're still lying upstairs. And there's a machine too to play them. An old machine.
DP_03,T'ad ooilley er ve currit er CDyn nish.,They've all been put on CDs now.
DP_04,"Ta tooilley ry gheddyn nish. Ta tooilley ry gheddyn, as s'treisht lhiam dy bee ad ooilley ry gheddyn ec yn thie tashtee dy gherrid.","There are more available now. There are more available, and I hope that they will all be available at the museum soon."
DP_04,Ta tooilley ayn ansherbee. Ta mee jeeaghyn roym rish clashtyn rish ny recoyrtyssyn shen gyn dooyt erbee.,"There are more anyway. I look forward to hearing those recordings, definitely."
DP_04,"Agh t'ad feer doillee, nagh vel? Er yn oyr ta ooilley ny tapeyn brisht, er lhiam's.","But they're very difficult, aren't they? Because all the tapes are broken, I think."
DP_04,"Va Ritchie gra, ec y toshiaght va ny tapeyn jeant ass pabyr, as v'ad ooilley coodit lesh myn yiarn, as car ny bleeantyn ta myn yiarn caghlaa gys mergey.","Ritchie said, in the beginning the tapes were made from paper, and they were all covered with iron filings, and through the years the iron filings turn to rust."
DP_04,"T'ad ooilley mergey. As cha dod oo cloie ad, t'ad ooilley brisht.","They're all rust. And you couldn't play them, they're all broken."
DP_04,"Agh ta greieyn ayn, er lhiam's, as oddagh yn greie glenney ny tapeyn, as t'ad er ve aayeant.","But there are machines, I think, and the machine could clean the tapes, and they've been redone."
DP_04,"Tra v'ou goaill toshiaght gynsaghey Gaelg, c'red va sleih coontey jeh'n Gaelg ec yn traa shen?","When you were starting to learn Manx, what did people think of Manx at that time?"
DP_04,"Cha row- kuse dy, va shenn sleih cha row ad coontey monney jeh'n Ghaelg.","There weren't- a few, there were old people who didn't think much of Manx."
DP_04,"V'ad gra, 'Cha jean oo cosney veg veih'n chengey shen, ghooinney. T'eh ooilley boghtynid.'","They would say, 'You won't earn anything from that language, man. It's all nonsense.'"
DP_04,"Va shenn dooinney cliaghtey cheet gys yn shapp, gys yn shapp ain, gow my leshtal, as vrie mee jeh, 'Vel fockle ny ghaa dy Ghaelg ayd, ghooinney?'","An old man used to come to the shop, to our shop, excuse me, and I asked him, 'Do you know a word or two of Manx, man?'"
DP_04,"As dooyrt eh, 'Gaelg? Gaelg? Ta shen boghtynid, ghooinney. Cha nel yn Gaelg feeu veg!' v'eh gra.","And he said, 'Manx? Manx? That's nonsense, man. Manx is worthless!' he said."
DP_04,V'eh slane noi. As cre'n fa?,He was totally against it. And why?
DP_04,Geddyn corree agglagh.,Getting awfully angry.
DP_04,"Well, foddee dy row eh- ayns ny laghyn roish shen, foddee dy row eh bwoailt ass jeu, choud's v'ad ec yn scoill.","Well perhaps it was- in the days before that, it was probably beaten out of them, while they were at school."
DP_04,As dooyrt Ritchie- dinsh Ritchie skeeal dou mychione tra va eshyn ec yn scoill ayns Rhumsaa.,And Ritchie said- Ritchie told me a story about when he was at school in Ramsey.
DP_04,"As va gilley ayn, as v'eh rubbal ny laueyn ry cheilley myr shen, as vrie yn fer lhee- yn fer insee, 'C'red t'ou jannoo, bhoy?'","And there was a boy, and he was rubbing his hands together like that, and the doctor- the teacher, asked, 'What are you doing, boy?'"
DP_04,"As dooyrt eh, 'Oh, ta mee just geddyn scoothyns, ghooinney.'","And he said 'Oh, I'm just getting scoothyns, ghooinney.'"
DP_04,"As dooyrt eh, 'Scoothyns? Cre'n sorch dy fockle ta shen?'","And he said, 'Scoothyns? What sort of word is that?'"
DP_04,"As dooyrt eh, 'Cha s'aym's. Foddee dy vel eh Gaelg.'","And he said, 'I don't know. Maybe it's Manx.'"
DP_04,"As dooyrt eh, 'Cha nel shiu lowit-' As ren eh bwooalley eh, ghooinney, son loayrt ass y Gaelg ayns brastyl.","And he said, 'You are not allowed-' and he beat him, man, for speaking Manx in the class."
DP_04,Va shen yn aght.,That was the way.
DP_04,"Shen yn aght. Quoi elley va goll mygeayrt ec yn traa shen, gynsaghey Gaelg? Quoi elley v'ayn?","That's the way. Who else was going about at that time, learning Manx? Who else was there?"
DP_04,"Oh, quoi elley? Well, lhig dou smooinaghtyn. sy brastyl ain va Davey Fisher ayn, as Davey Burns, as Davey Quillin â€“ 'Wavey' - as Fiona, as va kuse dy leih elley.","Oh, who else? Well, let me think. In our class there was Davey Fisher, and Davey Burns, and Davey Quilley â€“ 'Wavey' â€“ and Fiona, and a few other people."
DP_04,"Oh, Bobby Bob. As Paaie. As v'ad ooilley sy vrastyl cheddin.","Oh, Bobby Bob. And Peggy. And they were all in the same class."
DP_04,"Gow my leshtal, cha row Bobby ayn, va Bobby sy vrastyl roish shen.","Sorry, Bobby wasn't there, Bobby was in the class before that."
DP_04,"Va shen nuy cheead jeig daa yeig as tree feed, er lhiam's dy row.","That was nineteen seventy two, I think it was."
DP_04,Foddee blein ny ghaa eddyr.,Maybe a year or two between.
DP_04,B'ione dhyt Doolish y Karagher?,Did you know Douglas Faragher?
DP_04,"Oh, va. Va enney aym's er. Va Doolish- she dooinney agglagh v'eh.","Oh, yes. I knew him. Douglas was- he was a terrible man."
DP_04,"Oh, va skeealyn- tra v'eh prowal gynsaghey yn Gaelg dooin, as v'eh just ginsh skeealyn.","Oh the stories- when he was trying to teach us Manx, and he was just telling stories."
DP_04,"Cha row eh son gynsaghey monney dooys, v'eh just loayrt skeealyn, shen ooilley.","He wasn't for teaching us much, he would just speak stories, that's all."
DP_04,"Ginsh skeealyn. V'eh. As va eshyn as Quillin, v'ad nyn neesht jeu loayrt ry cheilley, as va shen yn jerrey jeh'n lessoon, ghooinney.","Telling stories. Yeah. And him and Quillin, both of them would talk together, and that was the end of the lesson, man."
DP_04,Mie dy liooar. Ta reddyn goll dy mie nish ansherbee.,OK. Things are going well now anyway.
DP_04,"Oh, ta. Ta mee credjal shen.","Oh, yeah. I believe so."
DP_04,Ayns ny laghyn shen cha row eer yn lheid myr shen. Scoillyn gaelgagh.,In those days there wasn't even anything like that. Manx schools.
DP_04,"Oh, Shee bannee mee! Yn Bunscoill.","Oh, God bless me! The Manx school."
DP_04,Cha row shin eer smooinaghtyn mychione lheid myr shen ayns ny laghyn shen.,We weren't even thinking about the like of that in those days.
DP_04,As geddyn argid veih'n reiltys neesht.,And getting money from the government too.
DP_04,Ec yn traa t'ayn ansherbee!,At the moment anyway!
DP_04,"Startaghyn mooarey, ghooinney!","Big jobs, man!"
DP_04,"Oh aye, yeah. Gyn dooyt erbee. T'eh feer vie, nagh vel. Mie dy liooar.","Oh aye, yeah. No doubt. It's very good, isn't it. OK."
DP_04,"Ooilley pooar gys yn uillin, ghooinney!","All power to your elbow, man!"
DP_04,"Cre'n sorch reddyn s'mie lhiat jannoo ayns yn traa seyr ayd nish, ghooinney? Vel oo just gobbraghey ayns y gharey, son yn chooid smoo?","What sort of things do you like to do in your free time now, man? Do you just work in the garden, mostly?"
DP_04,"Well, she. sy tourey t'eh kiart dy liooar, as sy geurey cha nel eh feeu goll magh. S'mie lhiam paintal.","Well, yeah. In the summer it's alright, and in the winter it's not worth going out. I like to paint."
DP_04,"Oh, mie dy liooar.","Oh, OK."
DP_04,"Cha nel mee feer vie, t'ou toiggal. sy geurey ta mee lheid myr shen.","I'm not very good, you know. In the winter I do that kind of thing."
DP_04,"As b'vie my charrey Linda as mee hene, b'vie lhien shooyl mygeayrt yn Ellan, tra ta'n emshir cooie, t'ou toiggal.","And my friend Linda and me, we like to walk around the Island, when the weather is fine, you know."
DP_04,Ooilley mygeayrt ny sleityn as yn lheid.,All around the mountains and the like.
DP_04,"C'raad share lhiat shooyl, ghooinney?","Where do you prefer to walk, man?"
DP_04,C'red?,Eh?
DP_04,C'raad share lhiat shooyl? Ayns y jiass?,Where do you prefer to walk? In the south?
DP_04,"Ayns y jiass. Aye, share lhiam yn jiass. Ooilley mygeayrt yn Sloc as Fleshwick as lheid myr shen.","In the south. Aye, I prefer the south. All around the Sloc and Fleshwick and the like."
DP_04,"Ooilley mygeayrt yn voayl. Agh yn jiass, s'mie lhiam yn jiass. As mygeayrt ny Chasm neesht.","All around the place. But the south, I like the south. And around the Chasms too."
DP_04,R'ou rieau goll magh shelg conneeyn?,Did you ever go out hunting rabbits?
DP_04,Va mee my helgeyr ayns ny bleeantyn goll shaghey.,I was a hunter in years passed.
DP_04,"Dreill mee ferradyn, as va coo aym's as moddey tarroo neesht.","I kept ferrets, and I had a hound and a bulldog too."
DP_04,"Bunnys dagh kione shiaghtin va mish as my chaarjyn goll magh er y twoaie wooar, t'ou toiggal, er yn oyr va smoo conneeyn er y twoaie wooar, as v'ad s'aasey dy reuyrey ad ass y thalloo er yn oyr v'an thalloo ooilley geayney, t'ou toiggal, as v'eh aashagh dy liooar.","Almost every weekend me and my friend would go out in the north, you know, because there were more rabbits in the north, and they were easier to dig them out of the ground because the ground was all green, you understand, and it was fairly easy."
DP_04,Ta rouyr creggyn ayn sy jiass.,There are too many rocks in the south.
DP_04,"Ansherbee, va shin cliaghtey goll magh er ny mwaaee neesht lesh londeyr as coo syn oie, tra va'n dorraghys ayn.","Anyway, we used to go out after hares too with a lantern and a dog in the night, when it was dark."
DP_04,"Va. Hooar mee ram argid veue. Conneeyn, she.","Yeah. I got a lot of money from them. Rabbits, yeah."
DP_04,R'ou creck ooilley ny conneeyn?,Did you sell all the rabbits?
DP_04,"Va shin creck ad sy chapp, t'ou toiggal.","We sold them in the shop, you know."
DP_04,Va mee gobbraghey sy chapp butÃ§hoorys.,I was working in the butcher's shop.
DP_04,"Va fer ayn, as v'eh cliaghtey cheet un cheayrt sy vlein, as v'eh geddyn ooilley ny crackanyn.","There was a man, and he used to come once a year, and he would get all the skins."
DP_04,As cha s'aym's c'red v'eh jannoo lesh ny crackanyn.,And I don't know what he was doing with the skins.
DP_04,As v'eh orrin chirmaghey yn crackan.,And we had to dry the skin.
DP_04,"V'ad cur sollan as ollym- v'ad rubbal sollan as ollym ayndaue dy hirmaghey ad, as eisht croghey ad syn aer, as v'ad geddyn chirrym, as eisht cur ad ayns sack.","They would put salt and alum- they'd rub salt and alum in them to dry them, and then hang them in the air, and they would dry out, and then put them in a sack."
DP_04,"As v'eh cheet, as va shin geddyn skillin y pheesh er nyn son.","And he'd come, and we would get a shilling a piece for them."
DP_04,"As foddee- well, cheayll mee, cha nel mee shickyr my ta kiart ny dyn, agh cheayll mee dy row ooilley ny crackanyn goll ersooyl gys Sostyn as v'ad jannoo laueyn assdaue.","And maybe- well, I heard, I'm not sure if it's right or not, but I heard that all the skins went away to England, and they made gloves from them."
DP_04,Vel shen yn fockle son gloves?,Is that the word for gloves?
DP_04,"Laueanyn, yeah.","Gloves, yeah."
DP_04,Laueanyn. V'ad jannoo laueanyn assdaue.,Gloves. They made gloves from them.
DP_04,"Ta mee er chlashtyn eh. Cha nel- my ta shen kiart ny dyn, cha s'aym's, ghooinney, agh cheayll mee shen ansherbee.","I've heard that. I don't- if that's right or not, I don't know, man, but I heard it anyway."
DP_04,So v'ou goll magh shelg er yn twoaie wooar son yn chooid smoo.,"So you went out hunting in the north, mostly?"
DP_04,"Er yn twoaie wooar, she. Ayns Balley Laagh.","In the north, yeah. In Ballaugh."
DP_04,Va shen y boayl. Va daa ny three gowaltys as va kied ain dy shelg ayns shen.,That was the place. There were a few farms and we had permission to hunt there.
DP_04,"Agh v'eh slane- ayns ny laghyn shen v'eh slane noi'n leigh dy gholl magh [shelg] er yn oie, t'ou toiggal.","But it was completely- in those days it was completely against the law to go out [hunting] in the night, you know."
DP_04,"As va shin goll magh, as kuse dy cheayrtyn va ny meoiryn shee geiyrt orrin, ghooinney, agh cha row shin rieau caillt.","And we went out, and a few times the police were chasing us, man, but we were never lost."
DP_04,"Cha row shin rieau goit, gow my leshtal.","We were never arrested, sorry."
DP_04,Goit ec ny meoiryn shee.,Arrested by the police.
DP_04,"Oddagh oo fakin ad cheet, fakin yn soilsheenyn [sic] cheet tessin ny magheryn as va shin roie ersooyl.","You could see them coming, see the lights coming over the fields and we would run away."
DP_04,As va mee cliaghtey goll er ny braddanyn neesht.,And I used to go after the salmon too.
DP_04,"Jannoo ymmyd jeh clep as loob. Ooilley mygeayrt yn ellan, ny awinyn.","Using a hook and loop. All around the Island, the rivers."
DP_04,"Er lhimmey jeh yn awin ec Sulby, yn Awin Stondane, as ny daa hawinyn ayns Doolish.","Except for the river at Sulby. The Santon Burn, and the two rivers in Douglas."
DP_04,Va ram braddan ayn ayns ny laghyn. Ram jeu.,There were lots of salmon in those days. Lots of them.
DP_04,Ta mee er n'akin ad ec ny easyn ayns Cronkbourne as er y droghad Poyl Roish neesht.,I've seen them at the waterfalls in Cronkbourne and at Pulrose bridge too.
DP_04,Ta mee er n'akin keeadyn jeu goll seose ny- kys t'ou gra waterfall? Eas.,I've seen hundreds of them going up the- how do you say waterfall? Eas.
DP_04,Eas.,Eas.
DP_04,"Easyn. Shen eh. Ta mee er n'akin keeadyn jeu, ghooinney.","Waterfalls. That's it. I've seen hundreds of them, man."
DP_04,Cha nel yn laa t'ayn jiu.,Not now.
DP_04,Cha nel. Ta kuse jeu foast ayn agh cha nel monney.,No. There are still a few but not many.
DP_04,"Ta mee er clashtyn dy vel kuse jeu er yn awin Neb, as Sulby neesht, agh Doolish, cha nel mee shickyr.","I've heard that there are a few in the river Neb, and Sulby too, but Douglas, I'm not sure."
DP_04,"Ta ram stoo cheet seose yn awin woish, well, er lhiam's woish ny gowaltyssyn.","A lot of stuff comes down the river from, well, I think from the farms."
DP_04,"Woish ooilley ny kemmigyn t'ad jannoo ymmyd jeh, as t'ad er chur baaase da ny braddan beg.","From all the chemicals they use, and they've killed the young salmon."
DP_04,Cuin v'ou goll magh er yn vraddan shen? Feed blein er dy henney? Foddey na shen?,When were you going after salmon? Twenty years ago? Longer than that?
DP_04,Tra va mee my ghooinney aeg.,When I was a young man.
DP_04,"Shen just feed blein er dy henney, ghooinney.","That's just twenty years ago, man."
DP_04,Gura mie mooar ayd!,Thanks very much!
DP_05,As cre mychione goll er yn eeastagh? Row oo rieau goll er yn cheayn?,And what about fishing? Were you ever at sea?
DP_05,"Oh, va. Va mee cliaghtey goll er y cheayn.","Oh, yeah. I used to go to sea."
DP_05,"Cha row shin goll magh lesh lieenteenyn, just lesh slatt as rimlagh, t'ou toiggal.","We didn't go out with nets, just with a rod and line, you know."
DP_05,Va ooilley sorch dy eeast ain ry-gheddyn.,We'd get all sorts of fish.
DP_05,"Ayns y valley, Balley Cashtal, va callig ayn, as boddagh, as brick marrey, as eer skarrag.","In the town, Castletown, there were pollack, and cod, and mackerel, and even skate."
DP_05,"Cha nel ayns y vaaie Balley Cashtal ayns baaie, kys t'ou gra, Stondane.","Not in Castletown bay, in, how do you say, Santon."
DP_05,Faggys da Port Grenaugh. Noi Port Grenaugh ta boayl mie son geddyn skarrag.,Near Port Grenaugh. By Port Grenaugh is a good place for getting skate.
DP_05,As skeddan neesht.,And herring.
DP_05,"S'cooin lhiam, oie dy row, va mish as three caarjyn, va shin er baatey, as haink shin er breck marrey, as erskyn ny breck marrey va skeddan ayn, as cha dod oo goll trooid ny neesht jeu.","I remember, one night, me and three friends, we were on a boat, and we came upon some mackerel, and above the mackerel were herrings, and you couldn't go through the both of them."
DP_05,"Va keeadyn jeu cheet magh ass, as dooyrt mee da my chaarjyn, 'Scuirr, caarjyn. T'ou goll ass dty cheeal, ghooinney.'","Hundreds of them were coming out, and I said to my friends, 'Stop, mates. You're going mad, man.'"
DP_05,Va kishtagyn lhome lane dy skeddan as breck marrey ain.,We had boxes full of mackerel and herrings.
DP_05,"As va shin magh er y cheayn fud ny h-oie, as tra haink shin erash er y nah voghrey","And we were out on the sea all night, and when we came back the next morning"
DP_05,"va shin goll mygeayrt ny thieyn prowal geddyn rey rish ooilley yn eeast, ghooinney.","we went all around the houses trying to get rid of all the fish, man."
DP_05,"As ec y jerrey daag shin ad cheu mooie yn thie oast yn Phott Glue,","And in the end we left them outside The Glue Pot,"
DP_05,as va'n sleih cheet magh ass as v'ad geddyn meeryn dy phabyr as v'ad cur ad as v'ad prowal dy geddyn thie.,and people were coming out and getting a piece of paper and putting them in it and trying to get them home.
DP_05,V'ad lieh meshtit goll seose yn traid.,They were half drunk going down the street.
DP_05,Agh cha nel mee er ve er y cheayn rish daa ny three bleeantyn nish.,But I haven't been on the sea for several years now.
DP_05,Row baatey ayd?,Did you have a boat?
DP_05,Cha nel baatey aym's.,I don't have a boat.
DP_05,"Va baatey ec my charrey agh ta eshyn geddyn shenn nish as cha nel eh son goll magh feer vennick, t'ou toiggal.","My friend had a boat but he is getting old now and he doesn't go out very often, you know."
DP_05,As cha nel yn emshir er ve feer vie son daa ny three bleeantyn nish son goll magh. Laa ny ghaa.,And the weather hasn't been very good for going out for a few years now. A few days.
DP_05,As traa ta'n emshir mie cha nel yn tidey kiart.,And when the weather is good the tide isn't right.
DP_05,Agh ta ram obbyr ry-yannoo aym's mygeayrt y hie aynsherbee.,But I have a lot of work to do around the house anyway.
DP_05,Vel oo goll dys Doolish monney?,Do you go to Douglas much?
DP_05,Cha nel. Cha nel mee coontey monney jeh Doolish.,No. I don't think much of Douglas.
DP_05,Ta ooilley ny bloody riftanee beaghey ayns shen.,All the bloody scallies live there.
DP_05,Nagh vel ad cummal ayns Balley Cashtal? Smooinnee mee dy row.,Don't they live in Castletown? I thought they did.
DP_05,"Foddee dy row uss er ve geaishtagh rish breagyn, ghooinney.","Maybe you have been listening to lies, man."
DP_05,Foddee dy vel.,Maybe.
DP_05,Agh ta kuse dy riftanyn ayn agh cha nel cho monney as Doolish.,But there are a few scallies but not as many as Douglas.
DP_05,Gyn dooyt erbee.,Definitely.
DP_05,Ta ooilley druggaghyn as yn lheid ayns Doolish.,There's all drugs and the like in Douglas.
DP_05,Va boirey kuse dy vleeantyn er dy henney.,There was a problem a few years ago.
DP_05,"Va boirey ayn bentyn rish druggaghyn ayns Balley Cashtal, agh booise da Jee ta dy meoiryn shee er geddyn greim orroo","There was a problem with drugs in Castletown, but thank God, the police have arrested them"
DP_05,as ta bunnys ooilley eer ayns prysoon ny ersooyl veih yn Ellan.,and they're almost all either in prison or off the Island.
DP_05,Cha nel monney boirey ain bentyn rish yn lheid myr shen nish ansherbee.,There's not much of a problem with drugs and the like now anyway.
DP_05,As vel oo goll ersooyl monney er laghyn seyrey?,And do you go away on holiday much?
DP_05,"Oh, she. Foddee daa cheayrt 'sy vlein.","Oh, yeah. Maybe twice a year."
DP_05,"B'vie lhien goll- well, foddee gys kione shiaghtin ayns Sostyn.","We like to goâ€”well, maybe for a weekend in England."
DP_05,"S'mie my charrey goll mygeayrt ny shappyn, t'ou toiggal.","My friend likes to go around the shops, you know."
DP_05,As nagh mie lhiat?,And don't you like to?
DP_05,"T'eh kiart dy liooar son lieh laa foddee, agh lurg shen ta mee gra, 'Well, ersooyl lhiat er ny chappyn as beeym ayns thie oast ennagh.'","It's alright for half a day maybe, but after that I say, 'Well, go off to the shops and I'll be in a pub.'"
DP_05,Lieh yn phabyr as geddyn braghtan as pint. T'eh kiart dy liooar.,Reading the paper and having a sandwich and a pint. It's alright.
DP_05,"As eisht, s'mie lhien goll gys yn Idaal, gys y twoaie, er ny loghyn, t'ou toiggal.","And then, we like to go to Italy, to the north, to the lakes, you know."
