Filename,Manx,English
DP_01,As ta mee er ve ayns Balley Cashtal neayr's yn laa shen.,And I've been in Castletown since that day.
DP_01,"So, cre cho foddey as v'ou ayns yn armee ayns, well, ayns Cyprus?","So, how long were you in the army in, well, in Cyprus?"
DP_01,"Ayns yn armee shey bleeantyn, as ayns Cyprus foddee blein dy lieh, as ayns Libya blein dy lieh neesht.","In the army, six years, and in Cyprus perhaps a year and a half, and in Libya a year and a half too."
DP_01,As va mee ayns- ooilley mygeayrt Aldershot son- oh! Va mee gobbraghey ayns Cashtal Windsor ec yn un cheayrt.,And I was in- all around Aldershot for- oh! I worked in Windsor Castle at the same time.
DP_01,"Aye. She, she. Va shen son daa vee, shen ooilley, tra va na ratchyn cabbil ayn ec Ascot.","Yeah. That was for two months, that's all, when the horse races were on at Ascot."
DP_01,"She. V'ad shirrey daa choagyrey, as hie mish as- va mish as fer elley currit da Cashtal Windsor, as va shin gobbraghey ayns y kishteen son ny- kys t'ou gra-","Yeah. They wanted two cooks, and me and- me and another man were sent to Windsor Castle, and we were working in the kitchen for the- how do you say-"
DP_01,adsyn va shirveishey yn Benrein as ooilley yn lught thie ecksh. V'eh experience. V'eh.,those who were attending on the Queen and all her family. It was an experience. It was.
DP_01,"As hie mee gys ny ratchyn neesht, nastee. Va shin lowit dy gholl son un laa.","And I went to the races too, free. We were allowed to go for one day."
DP_01,As va ooilley ny ardjee goll mygeayrt ooilley ceauit ayns gooynyn liauyr.,And all the important people going about all dressed in long gowns.
DP_01,Ard-mwannalee!,Snobs!
DP_01,"V'eh yindyssagh! Ard-mwannalagh, shen eh. 'Fastyr mie, fastyr mie!' Va mee garaghtee orroo.","It was wonderful! Snobbish, that's it. 'Good afternoon, good afternoon!' I was laughing at them."
DP_01,As cre gollrish v'eh tra haink oo erash dys Mannin lurg kuse dy vleeantyn ersooyl?,And what was it like when you came back to the Island after a few years away?
DP_01,"Oh, va caghlaays agglagh ayn.","Oh, there was an awful change."
DP_01,Row oo maynrey Ã§heet erash dys Mannin?,Were you happy coming back to the Island?
DP_01,"Well, va. Va mee maynrey dy liooar agh cha ren mee coontey monney jeh ooilley yn sleih noa va er jeet choud's va mee ersooyl.","Well, I was. I was happy enough but I didn't think much of all the new people that had come since I was away."
DP_01,"As loayrt mychione ard-mwannalagh, ghooinney. Ta cooinaghtyn ayms, laa dy row, va mish as kuse dy leih elley 'sy Ã§henn thie-oast Benrein ayns Rhumsaa.","And talking of snobbish, man. I remember, one day, me and a few other people were in the old Queen's pub in Ramsey."
DP_01,Cha nel eh ayn now. Nagh row eh losht?,It's not there now. Wasn't it burned down?
DP_01,Cha nel mee shickyr.,I'm not sure.
DP_01,Er lhiams dy row.,I think it was.
DP_01,"Cha nel mee goll dys Rhumsaa monney, t'ou toiggal.","I don't go to Ramsey much, you understand."
DP_01,Mish noadyr.,Me neither.
DP_01,"As ansherbee, va mee aynshen, as va daa hamyr ayn, as oddagh oo fakin 'sy hamyr elley, as quoi v'ayn agh fer enmyssit Freddie Cowle.","And anyway, I was there, and there were two rooms, and you could see into the other room, and who was there but a man called Freddie Cowle."
DP_01,"Va enney aym er Freddie, as hug mee shilley er, as dooyrt, 'Kys t'ou Freddie?' as ooilley y lheid myr shen.","I knew Freddie, and I went to see him, and said, 'How are you, Freddie?' and all that."
DP_01,"As dooyrt eh, 'Oh, jeeagh er ooilley ny mwannalyn-liauyrey.' dooyrt eh.","And he said, 'Oh, look at all the ""long necks"" [toffs].' he said."
DP_01,"As dooyrt mee, 'Mwannalyn-liauyrey? Cre'n fa vel oo cur yn far-ennym shen orroo?'","And I said, 'Long necks? Why do you call them that?'"
DP_01,"As dooyrt eh, 'Jeeagh orroo choud's t'ad goll mygeayrt, as ta pint ayns nyn laueyn, as t'ad gra, ""Oh, moghrey mie."" as, ""Fastyr mie."" ' as ooilley yn lheid myr shen.","And he said, 'Look at them while they go about, with a pint in their hands, and they say ""Oh, good morning."" and, ""Good afternoon."" ' and all that."
DP_01,"As dooyrt mee, 'Oh, foddym toiggal nish, ghooinney.'","And I said, 'Oh, I can understand now, man.'"
DP_01,She. Agh ayns ny laghyn shen- va shen jerrey ny tree-feedyn- as va ram sleih er jeet veih ny colonies.,Yes. But in those days â€“ that was the end of the sixties â€“ and a lot of people had come from the colonies.
DP_01,"V'ad Ã§heet stiagh 'sy Ã§happ raad va mee gobbraghey, as v'ad jannoo polt, myr shen, as v'ad gra, 'Boy, boy! Tar gys shoh!'","They would come into the shop where I was working, and they'd click, like that, and they'd say, 'Boy, boy! Come here!'"
DP_01,'Vel oo loayrt rhyms?' 'Tar gys shoh' 'Jeeagh er y crackan ayms. T'eh bane gollrish yn crackan ayds ghooinney. Cha nee dooinney gorrym mish'.,'Are you talking to me?' 'Come here!' 'Look at my skin. It's white like yours. I'm not a negro.'
DP_01,V'ad agglagh. Cha row mee coontey monney jeu. As cha nel mee son gra foddey...,They were awful. I didn't think much of them. And I'm not saying any more...
DP_01,Ec y traa shen v'ou erash ayns Balley Cashtal gobbraghey?,At that time you were back in Castletown working?
DP_01,"Va mee ayns Balley Cashtal. Va mee gobbraghey ayns Balley Cashtal agh va mee beaghey ayns Doolish, as lurg blein ny ghaa va mee poost as haink mee gys shoh dy chummal, t'ou toiggal.","I was in Castletown. I was working in Castletown but I was living in Douglas, and after a year or two I was married and I came here to live, you know."
DP_01,As ta mee er ve ayns y thie cheddin ooilley ny laghyn neayr's shen. As t'eh boayl mie dy liooar.,And I've been in the same house all the days since then. It's a good enough place.
DP_01,"As row oo goll magh er ny thieyn-lhionney, as yn lheid, ec yn oie?","And were you going out to the pubs, and such, at night?"
DP_01,Just kuse dy cheaytyn.,Just a few times.
DP_01,C'raad t'ou goll?,Where do you go?
DP_01,Keayt ny ghaa. 'Sy Phot Glue.,Once or twice. To the Glue Pot.
DP_01,"Ta mee er ve [goll] gys shen rish bleeantyn, ghooinney. S'mie lhiam y voayl shen- t'eh kune dy liooar.","I have been [going] there for years, man. I like that place â€“ it's calm enough."
DP_01,"Cha nel, kys t'ou gra, jukebox ny'n lheid myr shen aynshen. T'eh mie son shen deiney gollrhym-pene, ghooinney.","There's no - how do you say? - jukebox or the like there. It's good for old men like myself, man."
DP_01,"Ta shinyn soit sy corneil as ren shin, kys t'ou gra, ren shin loayrt mychione ooilley boghtynid y theihll as prowal dy chiartaghey eh, t'ou toiggal.","We sit in the corner and we  - how do you say? - we talked about all the nonsense of the world, and tried to right it, you know."
DP_01,T'ou foast jannoo shen ghooinney.,"You're still doing that, man."
DP_01,"Oh, ta.","Oh, yeah."
DP_01,"As cre gollrish va Balley Cashtal ec yn traa shen? Row, you know, ram shappyn ynnydagh ayn, as y lheid?","And what was Castletown like at that time? Were there many, you know, local shops, and the like?"
DP_01,"Well, ta. Va ram shappyn ayn, as ayns ny laghyn shen cha row monney sleih goll gys Doolish dy gholl er ny shappyn.","Well, yeah. There were a lot of shops, and in those days not many people went to Douglas to go shopping."
DP_01,"Agh nish ta gleashtanyn oc as t'ad ooilley ersooyl gys Doolish, er yn oyr ta shappyn mooarey ayns Doolish, t'ou toiggal.","But now they have cars and they're all away in Douglas, because there are supermarkets in Douglas, you know."
DP_01,As ta sorÃ§h dy chaghlaays er ve ayn.,And there has been a sort of change.
DP_01,"Ta mee er ve jeeaghyn er y valley rish bleeantyn as ta mee er n'akin eh goll, well, er my hon-hene, t'eh er ve goll sheese as goll sheese yn ughtagh, ghooinney.","I have been looking at the town for years and I've seen it go, well, for me, it's been going downhill, man."
DP_01,"Well, sheese y lhag, gow my leshtal.","Well, into depression, sorry."
DP_01,"Va mee just sheiltyn d'ou hene, dy vel oo briaght jee'm mychione yn Ã§happ noa ta er jeet dys Balley Cashtal.",I was just imagining to myself that you would ask me about the new shop that's come to Castletown.
DP_01,Cha nel mee son gra veg my-e-chione.,I'm not saying anything about it.
DP_01,N'abbyr veg my-e-chione!,Don't say anything about it!
DP_01,Vel eh foshlit foast?,Is it open yet?
DP_01,Well ta paart jeh foshlit.,Well part of it is open.
DP_01,"As ta mee er chlashtyn dy vel ad shirrey kied dy chreck lhune, as y lheid, as jough lajer.","And I've heard that they are seeking a licence to sell beer, and the like, and spirits."
DP_01,Ren mee lhaih beggan mychione...,I read a bit about it...
DP_02,"Vel oo cooinaghtyn- well, ta mee foast cooinaghtyn yn shenn thie-lhionney v'ayn keayrt dy row ayns straid- t'eh dooint nish.","Do you remember- well, I still remember the old pub that was once on- it's closed now."
DP_02,"She thie t'ayn nish, t'ou toiggal.","It's a house now, you see."
DP_02,"Ah, Yn Victoria?","Ah, The Victoria."
DP_02,"Yn Victoria, yeah.","The Victoria, yeah."
DP_02,"Oh she. Va mee ayns shen keayrt ny ghaa, as cheayll mee skeeal mychione y voayl shen.","Oh yeah. I was there a few times, and I heard a story about that place."
DP_02,"Va carrey aym's as- ta shoh yn astyr ta mee loayrt mychione- as va just daa ghooinney ayn, my charrey as fer elley.","A friend of mine and- this is the afternoon I'm talking about- and there were just two men there, my friend and another man."
DP_02,"As va my charrey loayrt rish yn dooinney va soit ayns y chorneil, as cha row eh gra veg, as ansherbee, hie my charrey da, as dooyrt eh, 'Vel oo kiart, ghooinney?'","And my friend was talking to the man who was sat in the corner, as he wasn't saying anything, and anyway, my friend went to him, and he said, 'Are you OK, man?'"
DP_02,"As va'n dooinney boght marroo, ghooinney. V'eh ny soie marroo sy corneil.","And the poor fella was dead, man. He was sitting dead in the corner."
DP_02,"As ren y lheid haghyr dooys oie dy row va mee ayns y Phot Glue, as va mee my hashoo ec y var, as va fer ny hassoo aynshoh, as va fer elley er y cheu elley jeh'n dooinney, fer ceauit ayns fillee beg.","And something like that happened to me one night when I was in the Glue Pot, and I was standing at the bar, and there was a man standing here, and another on the other side of the man, a man wearing a kilt."
DP_02,"Fer mooar, dooinney stoamey v'eh.","A big fella, a well built man he was."
DP_02,"As ansherbee, huitt yn fer va eddyr ny neesht jeu, huitt eh sheese er y laare, as v'eh marroo.","And anyway, the man who was between them fell, he fell down on the floor, and he was dead."
DP_02,"As dooyrt yn fer- ren yn fer ceauit ayns y fillee beg, ren eh chyndaa mygeayrt as dooyrt eh, 'I say, Brian, you've just spilled my drink.'","The the man said- the man wearing the kilt, he turned around and he said, 'I say, Brian, you've just spilled my drink.'"
DP_02,"As va'n fer ny lhie marroo er y laare. Shen skeeal agglagh, nagh vel?","And the man was lying dead on the floor. That's a terrible story, isn't it?"
DP_02,Cha nel mee credjal shen.,I don't believe that.
DP_02,As keayrt elley va dooinney ayn as v'eh cloie stubbin.,And another time there was a man there playing darts.
DP_02,"As haink eh dooys, as va mish as my ven er y corneil as va shin just loayrt ry cheilley, as haink eh dooin, as dooyrt eh, 'B'vie lhiat cloie stubbin marym, Derek?'","And he came to me, and me and my wife were in the corner just talking to each other, and he came to us, and he said, 'Would you like to play darts with me, Derek?'"
DP_02,"As dooyrt mee, 'Ayns minnid ny ghaa, Tom, bee eh kiart dy liooar. Ta mee just loayrt rish my ven.'","And I said, 'In a minute or two, Tom, it'll be fine. I'm just talking to the wife.'"
DP_02,"As ansherbee, hyndaa eh, as hie eh erash gys yn vrat laare raad v'ad cloie stubbin, as huitt eh sheese.","And anyway, he turned and went back to the carpet where they were playing darts, and he fell down."
DP_02,As lheim my ven soese dy tappee er yn oyr she boandyr v'ee.,And my wife leaped up quickly because she was a nurse.
DP_02,"Oh, mie dy liooar.","Oh, OK."
DP_02,"She. As ren ee geddyn greim. As va fer elley, as va eshyn ny boandyr neesht, as ren ny neesht jeu prowal dy yannoo yn stoo er y cleeu echey.","Yeah. And she took hold. And there was another man, and he was a nurse too, and both of them tried to do the stuff on his chest."
DP_02,"As yn dooinney boght, va eshyn marroo neesht.","And the poor man, he was dead too."
DP_02,As v'eh ny lhie er y- as ren shin geddyn rey rish yn sleih. As va just kuse jeein tannaghtyn rish yn ambulance dy heet.,And he was lying on the- and we got rid of the people. And there were just a few of us waiting for the ambulance to come.
DP_02,"As choud's v'eh ny lhie, v'eh coodit lesh clooisag. Vel oo gra clooisag da blanket? V'eh coodit.","And while he was lying, he was covered with a blanket. Do you say clooisag for a blanket? He was covered."
DP_02,"As lurg, foddee, lhieh oor, ren eh myr shoh, as hoie eh sheese reesht.","And after, perhaps, half an hour, he did this, and he sat up again."
DP_02,"As va shin jeeaghyn er. As dooyrt my ven dooys, va shen yn aer scapail woish.","And we were looking at him. And my wife said to me, that was the air escaping from him."
DP_02,"Shee bannee mee, va my chree goll myr shoh.","God bless me, my heart was going like this."
DP_02,"Well, ta shen skeeal dy jarroo.","Well, that's a story indeed."
DP_02,Skeeal agglagh.,Terrible story.
DP_02,"Skeealyn agglagh gyn dooyt erbee. So vel oo foast goll magh er ny thieyn lhionney ny laghyn t'ayn jiu, ny dyn, or?","Terrible stories, no doubt. So do you still go out to the pubs these days, or not, or?"
DP_02,"Well, cha bee'm ayn yn laa t'ayn jiu. Bee'm ec yn Albert oie ny vairagh. Shen eh.","Well, I won't be today. I'll be at the Albert tomorrow night. That's it."
DP_02,"Ta, ta mee son goll.","Yeah, I mean to go."
DP_02,As s'treisht lhiam dy bee kuse dy gaelgeyryn ayn.,And I hope there will be a few Manx speakers there.
DP_02,Bee. S'treisht lhiam dy bee ansherbee.,There will be. I hope there will be anyway.
DP_02,As kiaulleyderyn neesht.,And musicians too.
DP_02,"Ta seshoon feer vie goll er ec yn Ablert, nagh vel? Mie dy liooar.","It's a good session at the Albert, isn't it? Good enough."
DP_02,Cre gollrish v'eh gobbraghey ayns Balley Cashtal ayns y chapp vutchoor? Row eh mie dy liooar?,What was it like working in Castletown in the butcher's shop? Was it alright?
DP_02,"Oh, v'eh. Va skeealyn agglagh goll er.","Oh, yeah. There were some awful stories."
DP_02,"Nyn eddyr oc, t'ou toiggal. Va shenn dooinney gobbraghey ayns shen anmyssit Chalse Cubbon.","Between us, you know. There was an old man working there called Charles Cubbon."
DP_02,"She dooinney agglagh v'eh. Va skeealyn atch ooilley bentyn rish shenn sleih va cliaghtey beaghey ayns Balley Cashtal, eddyr y daa chaggey, t'ou toiggal.","He was a terrible man. There were funny stories all about the old people who used to live in Castletown, between the wars, you know."
DP_02,"Oh, she dooinney yindyssagh v'eh. Va cooinnaghtyn ayms laa dy row va shin gobbraghey ry cheilley, as v'eh ny haaue ec y traa v'ayn, agh v'eh cliaghtey cheet, cur cooney dooin.","Oh, he was a wonderful man. I remember one day we were all working together, and he was retired at that time, but he would come and help us."
DP_02,"As va ny neesht jeein gobbraghey ry cheilley, as va shin jannoo pronnagyn, t'ou toiggal.","And the two of us were working together, and we were making sausages, you know."
DP_02,"As dooyrt eh, 'Och, cha nel mee gennaghtyn feer vie, Derek.' dooyrt eh. 'Er lhiams dy vel eh orryms goll thie.'","And he said, 'Och, I don't feel very well, Derek.' He said. 'I think I have to go home.'"
DP_02,"As ansherbee hie eh thie, as er y nah voghrey tra haink mee stiagh sy chapp, dooyrt my vainshter d'ou, 'Oh, Derek, ta naight agglagh ayms.'","And anyway, he went home, and the next morning when I came into the shop, my boss said to me, 'Oh, Derek, I have some terrible news.'"
DP_02,"As dooyrt, 'Cre'n sorch dy naight?' as dooyrt eh, 'Ta Chalse er n'eddyn baase, ghooinney.'","And I said, 'What sort of news?' and he said, 'Charles has died, man.'"
DP_02,Ta. As tra haink e ven dys yn chapp ayms v'ee gra dy dooyrt eh moghey sy voghrey- cha nel mee shickyr yn ennym urree. Lhig dooin gra v'ee enmyssit Paaie ansherbee.,"Yeah. And when his wife came to my shop she was saying that he said, early in the morning- I'm not sure what her name was. Let's say she was called Peggy anyway."
DP_02,"'Paaie, ta paase agglagh orrym. Vod oo geddyn mish gless dy ushtey?'","'Peggy, I'm terribly thirsty. Can you get me a glass of water?'"
DP_02,"As hie ee ersooyl dy gheddyn gless dy ushtey, as tra haink ee erash va eshyn ny lhie marroo, ghooinney.","And she went away to get a glass of water, and when she came back he was lying dead, man."
DP_02,"V'eh. Chalse boght. Agh va skeealyn yindyssagh- er yn oyr va fys ain er dy chooilley sleih va cheet stiagh, t'ou toiggal.","He was. Poor Charles. But wonderful stories- because we knew all the people who came in, you know."
DP_02,"V'ad ooilley cummal ayns Balley Cashtal, son y chooid smoo.","They all lived in Castletown, for the most part."
DP_02,"Dy chooilley jeu cummal ayns Balley Cashtal. As va ny eirinee cheet, t'ou toiggal.","All of them lived in Castletown. And the farmers would come, you know."
DP_02,"Ta mee er n'akin shinyn nyn shashoo- well, va shin son dooney ny dorryssyn ec shey.",I have seen us standing- well we would close the doors at six.
DP_02,"Well, lhig dooin gra, eddyr shey as shiaght fastyryn Jeheiney, as ta mee er n'akin shinyn, ghooinney, just loayrt as loayrt as jannoo skeealyn, ginsh skeealyn.","Well, let's say, between six and seven Friday afternoons, and I've seen us, man, just talking as talking, and making stories, telling stories."
DP_02,Beemayd aynshen derrey hoght ny nuy er y chlag.,We'd be there until eight or nine o'clock.
DP_02,"As eisht v'eh orryms goll dy geddyn oohyn veih gowaltys ayns Balley'n Eass, as eisht veih Balley'n Eass gys Doolish, cur feill da kuse dy hieyn ayns Doolish, as cha row mee geddyn thie mee hene derrey jeih er y clag.","And then I had to go and get eggs from a farm at Ballanass, and then from Ballanass to Douglas, bringing meat to a few houses in Douglas, and I wasn't getting home myself till ten o'clock."
DP_02,"Agh, cha ren shin smooinaghtyn monney mychione shen ghooinney.","But, we didn't think much about that, man."
DP_02,As row oo gobbraghey Jesarn?,And were you working Saturday?
DP_02,Va. She. Dagh Jesarn. Shey laghyn sy hiaghtin.,I was. Yeah. Every Saturday. Six days a week.
DP_02,"Va shin geddyn lieh laa jerdein. Va lieh laa ain jerdein, as eer sy tourey va shin cho tarroogh va shin gobbraghey er y Doonaght neesht.","We got a half day Thursday. We had a half day Thursday, and even in the summer we were so busy we would work on Sunday too."
DP_02,"She, va shin gobbraghey- va shin cliaghtey shirveish shapp ayns Doolish va creck hot dogs as- kys t'ou gra burgeryn?","Yeah, we were working- we used to serve a shop in Douglas that sold hot dogs and- how do you say burgers?"
DP_02,Burgeyryn,Burgers.
DP_02,Burgeyryn. Aye. As va shen yn obbyr ain moghrey Jedoonee.,Burgers. Yeah. And that was our work Sunday morning.
DP_02,"Va shin jannoo pronnagyn as burgyeryn er y shapp shen, as v'eh geddyn rey rish tousanenyn as thousaneyn jeu dagh hiaghtin, ghooinney.","We were making sausages and burgers in that shop, and he sold thousands and thousands of them every week, man."
DP_02,Cha dod oo credjal yn lheid. As va thousanenyn as thousaneyn dy keayrtee ayns Doolish ayns ny laghyn shen.,You couldn't believe the like. And there were thousands and thousands of visitors in Douglas in those days.
DP_02,Thousaneyn jeu.,Thousands of them.
DP_02,Ooilley son ny skibbyltee boghtey son y chooid smoo?,"All for the trippers, mostly?"
DP_02,"Well, t'ou gra 'skibbyltee boghtey' agh ta mee er chlashtyn 'keayrtee'.","Well, you say 'trippers' but I have heard 'visitors'."
DP_02,"Keayrtee. Shen kiart, gyn dooyt erbee.","Visitors. That's right, no doubt."
DP_02,"Ny skibbyltee, aye.","The trippers, aye."
DP_02,Mie dy liooar. As row ram jeu cheet dys Balley Cashtal sy tourey?,OK. And did a lot of them come to Castletown in the summer?
DP_02,"Cha row monney. Well, cha nel monney ry akin er lhimmey jeh'n cashtal, shen ooilley.","Not many. Well, there's not much to see except for the castle, that's all."
DP_02,"Cha row monney shappyn creck stoo er nyn son, t'ou toiggal. Va kuse dy thieyn bee ayn, as va shen ooilley.","There weren't many shops selling stuff for them, you know. There were a few restaurants, and that was all."
DP_02,Cha nel traie ayn noadyr.,There's no beach either.
DP_02,"Well, cha nel traie ayns Balley Cashtal, as ta'n traie feer foddey ersooyl, son ny skibbytlee ansherbee.","Well, there's no beach in Castletown, and the beach is very far away, for the trippers anyway."
DP_02,"V'ad just cheet er y charabanc as eisht v'ad goll gys Purt Chiarn as Purt le Moirrey, as lheid myr shen.","They would just come on the charabanc and then they'd go to Port Erin and Port St Mary, and the like."
DP_02,"Agh va ram jeu ayns ny laghyn- as nish, well, ta shin geddyn kuse dy coachyn veih Sostyn as t'ad cheet gys shoh son oor ny ghaa, as t'ad ooilley lhome lane dy shenn mraane as shenn deiney, as t'ad just stravaig mygeayrt y valley jeeaghyn er ny shappyn as eisht t'ad ersooyl ayns oor.","But there were a lot of them in those days- and now, well, we get a few coaches from England and they come here for an hour or two, and they're all full of old women and old men, and they just wander about the town looking at the shops and then they're gone in an hour."
DP_02,Aye.,Aye.
DP_02,Cha nel ad tannaghtyn foddey.,They don't stay long.
DP_02,Cha nel monney ayns Balley Cashtal er nyn son ansherbee.,There's not much for them in Castletown anyway.
DP_03,"Cre mychione ec y Nollick, ghooinney? R'ou tarroogh agglagh ec yn Nollick?","What about at Christmas, man? Were you terribly busy at Christmas?"
DP_03,"Oh, va. Oh, tarroogh! Va shin gobbragh, lhig dooin gra, woish shey sy voghrey gys mean oie.","Oh yeah. Oh, busy! We were working, let's say, from six in the morning to midnight."
DP_03,"Va shen yn shiaghtin roish y Nollick. Va shin cur baase da ny- kys t'ou gra turkey? Kiark Rangagh, vel?","That was the week before Christmas. We were killing the- how do you say turkey? Kiark Rangagh, is it?"
DP_03,"Yeah, shen kiart.","Yeah, that's right."
DP_03,"Da ny kiarkyn Rangagh, as ny thunnagyn, as ny guoiee. Va shin jannoo ooilley yn obbyr shen nyn hene, as eisht geddyn rey rish ny fedjagyn as, oh, Jee bannee mee!","The turkeys, and the ducks, and the geese. We did all that work ourselves, and then got rid of the feathers, and, oh, God bless me!"
DP_03,"As eisht- ayns Baarle t'ad gra dress. Cur rick orroo. As lurg my yinnair Laa y Nollick va mee goll gys my lhiabbee as va mee my chadley son bunnys daa oor yeig, ghooinney.","And then- in English they say 'dress'. Dressing them. And after my dinner on Christmas day I would go to my bed and sleep for almost twelve hours, man."
DP_03,Skee agglagh.,Awful tired.
DP_03,Skee. Va mee skee agglagh. Agh ta mee my haaue nish.,Tired. I was awful tired. But I am retired now.
DP_03,"Ta ooilley'n lught thie cheet thie. My paitchyn as my ineenyn oe. Ta dy chooilley cheet. As she coagyrey mie mish, ghooinney.","All the family come. My kids and my grand-daughters. They all come. And I'm a good cook, man."
DP_03,Well ta shen red mie gyn dooyt erbee.,"Well, that's a good thing, no doubt."
DP_03,"S'mie lhiam y Nollick, ghooinney, nish.","I like Christmas, man, now."
DP_03,Foddey ny share gyn obbyr.,Much better without work.
DP_03,"Oh, gyn ourys, ghooinney.","Oh, without doubt, man."
DP_03,Ta mee toiggal shen.,I understand that.
DP_03,Insh dou beggan mychione gynsaghey Gaelg. Cre'n fa ren oo goaill toshiaght ynsaghey yn chengey?,Tell me a bit about learning Manx. Why did you start learning the language?
DP_03,"V'eh quaagh. Laa dy row va mee gobbraghey sy chapp, as va my vainshter lhaih yn pabyr naight, as dooyrt eh, 'Oh, ta cowrey ayns shoh bentyn rish yn Ghaelg.'","It was strange. One day I was working in the shop, and my boss was reading the newspaper, and he said, 'Oh, there's an ad in here about Manx.'"
DP_03,"Dooyrt eh, 'T'ad just goaill toshiaght cummal brastyllyn ayns Doolish.' As va shen yn kied brastyl, ghooinney, ec yn colleish.","He said. 'They've just started holding classes in Douglas.' And that was the first class, man, at the college."
DP_03,"As dooyrt eh, 'Oh, ta mee smooinaghtyn mychione goll gys shen.' As ansherbee, cha row mee shickyr cre dy yannoo, as lurg brastyl ny ghaa va shin loayrt ry cheilley, as dooyrt eh, 'Oh, shegin diu goll, ghooinney.'","And he said, 'Oh, I'm thinking about going to that.' And anyway, I wasn't sure what to do, and after a couple of classes we were talking together, and he said, 'Oh, you should go, man.'"
DP_03,"As ansherbee, cha dod mee goll yn blein shen agh hie mee er y nah vlein.","And anyway, I couldn't go that year but I went the next year."
DP_03,"As ta cooinaghtyn ayms, lhaih mee sy pabyr naight boayl ennagh, as v'eh screeuit sy pabyr naight dy row daa ghilley ceauit magh ass thie oast ayns Purt ny hInshey, er lhiam's, son loayrt yn Gaelg.","And I remember, I read in the newspaper somewhere, and it was written in the newspaper that two boys were thrown out of a pub in Peel, I think, for speaking Manx."
