Filename,Manx,English
DQ_01,"Row oo er yn cheayn jiu, ghooinney?","Were you on the sea today, man?"
DQ_01,"Well, va shinyn, my vac as mee hene. Va shin ooilley mygeayrt yn Cholloo as mygeayrt Purt Çhiarn, derrey mysh tree er y chlag syn astyr va shen. V'eh feer heh sy vaatey jiu.","Well, we were, my son and myself. We were all around the Calf and around Port Erin, until about three o'clock in the afternoon, that was. It was very hot in the boat today."
DQ_01,Foddym toiggal shen.,I can understand that.
DQ_01,Cha row geay ayn as v'eh feer feer heh.,"There was no wind and it was very, very hot."
DQ_01,Cre'n traa hie oo magh? Sy voghrey? Ren oo goll magh sy voghrey?,What time did you go out? In the morning? Did you go out in the morning?
DQ_01,"Sy voghrey, yeah.","In the morning, yeah."
DQ_01,As c'raad ta'n baatey ayd? Vel eh ayns Purt hiarn ny Purt le Moirrey?,And where is your boat? Is it in Port Erin or Port St. Mary?
DQ_01,"Ayns Purt Çhiarn, ayns shoh. Ta mee kinjagh freayll yn baatey ainyn- ta mee er freayll ram jeu as v'ad ooilley freayllt ayns Purt Çhiarn, cha nel ayns Purt le Moirrey. Ta ram birling as y lhied ayns Purt le Moirrey. T'eh feer doillee geddyn magh as geddyn stiagh ayns y purt shen. Ayns Purt Çhiarn t'eh kiart dy liooar.","In Port Erin, here. I always keep our boat - I've kept lots of them and they were all kept in Port Erin, not in Port St. Mary. There are lots of yachts and such in Port St. Mary. It's very difficult to get in and out of that port. In Port Erin it's alright."
DQ_01,So cre hooar oo jiu? Just gimmee?,So what did you get today? Just lobsters?
DQ_01,"Gimmee, aye. As kuse dy phartanyn. Cha nel shin freayll ny partanyn gagh laa. Ta shin freayll kuse my row oardagh ain son kuse dy partanyn, shen ooilley. Ta shin ceau ad ersooyl. Cha nel shin marroo ad mannagh vel feme ain orroo.","Lobsters, aye. And a few crabs. We don't keep the crabs every day. We keep a few if we have an order for a few crabs, that's all. We throw them away. We don't kill them unless we need them."
DQ_01,C'raad t'ou creck ny gimmee ansherbee?,Where do you sell the lobsters anyway?
DQ_01,"T'ad goll dys dooinney ayns Anglesey. Ta eshyn cur ad gys y Jiass, dys Sostyn er lhiam's, as t'ad ersooyl gys y 'Rank as y Spansh er lhiam's. Ta shin geddyn tooilley argid er nyn son veih'n dooinney shoh.","They go to a man in Anglesey. He sends them to the South, to England, I think, and they go to France and Spain, I think. We get more money for them from this man."
DQ_01,Kys ta'n obbyr ec yn traa t'ayn? Vel reddyn goll dy mie?,How is the work at the moment? Are things going well?
DQ_01,"Oh, t'ad goll feer vie. Feer vie ec y traa t'ayn. Emshir braew ayn ansherbee.","Oh, it's going very well. Very well at the moment. Fine weather anyway."
DQ_01,Shen mie dy liooar.,That's alright.
DQ_01,"T'eh jannoo yn obbyr ny s'aasey, my t'ou laccal, tra t'eh kune myr shoh.","It makes the work easier, if you like, when it's calm like this."
DQ_01,"Quoid ren oo geddyn jiu? Ren oo geddyn ram, or?","How many did you get today? Did you get a lot, or?"
DQ_01,"Well, cha nel ram, agh ec y traa t'ayn t'ad s'goan, ayns mee voaldyn. Er lhiam's dy vel ad çheet ry cheilley son jannoo oohyn, my t'ou laccal, as t'ad lhie ayns nyn dowllyn as cha nel ad çheet magh. As tra t'eh mee ny jees ry heet t'eh geddyn ny share derrey yn fouyr gys y Nollick. Ta kuse dy ghimmee goll er ny veeghyn shen. Agh ec y traa t'ayn t'ad s'goan.","Well, not a lot, but at the moment they are scarce, in May. I think they come together to lay eggs, if you like, and they lie in their holes and don't come out. And in a month or two it gets better until the Autumn and Christmas. There are a few lobsters about in those months. But at the moment they are scarce."
DQ_01,As vel oo goll er yn eeastagh son red erbee elley or just gimmee?,And do you fish for anything else or just lobsters?
DQ_01,"Well, ny keayrtyn ta shin geddyn skeddan, ny keayrtyn, son bite, as geddyn breck varrey as stoo myr shen, as callig. As bleeantyn er dy henney va shinyn geddyn liehbage agh t'ad s'goan ec y traa t'ayn. S'goan t'ad.","Well, sometimes we get herring, sometimes, for bait, and get mackerel and things like that, and pollock. And years ago we used to get flatfish but they are scarce now. They're scarce."
DQ_01,"Cre cho foddey as t'ou er ve er yn cheayn, ghooinney? T'ou er ve er yn eeastagh rish bleeantyn as bleeantyn ta mee credjal.","How long have you been on the sea, man? You've been fishing for years and years I believe."
DQ_01,"Lhig dooin gra... quoid dy vleeantyn ta mish ec y eeastagh? Foddee daeed bleeantyn ec yn eeastagh, er lhiam's.","Let's say... how many years have I been fishing? Probably forty years fishing, I think."
DQ_01,As cre'n fa ren oo goll er yn eeastagh?,And why did you go fishing?
DQ_01,"Ta mish dy kinjagh goit er y eeastagh. Va mee laccal goll gys y eeastagh tra daag mee yn scoill agh dooyrt my phaarantyn, 'Cha bee cosney ad ayns y eeastagh. Bee shiuish foddey ny share goll ersooyl gy mooir dy gheddyn tooilley argid, as foddee bee shiu dty chaptan myr Juan Caine tra ta shiuish ny shinney. Cha daink mee yn ard shen.'","I was always taken with fishing. I wanted to go fishing when I left school but my parents said, 'You won't make money fishing. You'd be better going to sea to get more money, and maybe you'll be a captain like Juan Caine when you're older.' I didn't get that high."
DQ_01,"Mie dy liooar. Feer vie. V'ou ruggit as troggit ayns Purt le Moirrey, nagh row?","Alright. Very good. You were born and raised in Port St. Mary, weren't you?"
DQ_01,"Va mee ruggit ec yn Laare ayns shen er lhiam's. Va boanderey freayll thie ayns shen. Ben enmyssit Crellin v'ee, er lhiam's. V'ee ny boanderey as va mee ruggit ayns y thie ecksh er lhiam's. Cha nel mee shickyr c'raad ta'n thie agh er lhiam's dy vel eh faggys da'n Laare ayns Colby ayns shen. Er lhiam. Benainshter Crellin. Boanderey.","I was born at the Level there, I think. A nurse kept a house there. A woman named Crellin, I think. She was a nurse and I was born in her house, I think. I'm not sure where the house is but I think it's near the Level in Colby. I think. Mrs Crellin. A Nurse."
DQ_01,As cre'n sorch obbyr va'n jishag as ooilley yn lught thie echey jannoo ayns y phurt?,And what sort of work did your father and all his family do in the Port?
DQ_01,"Well va my yishag ny daahder ooilley e vea. Va eshyn ec mooir 'sy nah caggey, va shen ooilley, agh va eshyn ny daahder ooilley e vea.","Well my father was a painter all his life. He was at sea in the second war, that was all, but he was a painter all his life."
DQ_01,"Agh va my yishag vooar, va sorch dy obbyr quaagh ec y dooinney shen, v'eh jannoo queeylyn ass fuygh. As e ayr neesht, as e ayr, son sheeloghyn as sheeloghyn.","But my grandfather, he did a strange sort of work, he made wheels from wood. And his father too, and his father, for generations and generations."
DQ_01,Ec keayrtyn ta mee smooinaghtyn foddee haink yn ennym ain veih'n keird shen – wheeyllyn.,Sometimes I think perhaps our name came from that trade – wheels.
DQ_01,Shen eh. Cha s'aym's.,That's it. I don't know.
DQ_01,Foddee. Va ooilley ny shenn Vanninee gra 'Wheeyllyn'.,Perhaps. All the old Manx people said 'Wheeyllyn'.
DQ_01,Gyn dooyt erbee.,No doubt.
DQ_01,"Cha row ad gra Quillin, v'ad gra Wheeyllyn. Well ta shen, myr ta fys eu, ta shen yn plural jeh queeyl, nagh vel?","They didn't say Quillin, they said Wheeyllyn. Well that's, as you know, that's the plural of wheel, isn't it?"
DQ_01,"Foddee dy re Willie the Wheels, cha nel mee shickyr, my jishag wooar.","Perhaps he was 'Willie the Wheels', I'm not sure, my grandfather."
DQ_01,Foddee. Foddee dy vel oo kiart.,Maybe. Maybe you're right.
DQ_01,"Ta mee er chlashtyn ram eie mychione yn ennym. Ta kuse dy leih gra dy vel Quillin ass y Yernish holly, as kiart dy liooar va'n cowrey jeh'n lught thie ain va shen yn cullyn. Ta sleih elley gra she MacMillan. Cha nel mee shickyr. Myr dooyrt Doolish y Karagher, t'eh caillt.","I've heard lots of notions about the name. Some say Quillin is from the Irish 'holly', and rightly our family symbol was the holly. Others say it's MacMillan. I'm not sure. As Douglas Faragher said, it's lost."
DQ_01,Gyn dooyt erbee. C'raad va shiu ooilley cummal 'sy phurt?,No doubt. Where did you all live in the port?
DQ_01,"Va my jishag vooar as my ayr cummal ec y phurt eh hene, as va nyn thie creckit kuse dy vleeantyn er dy henney. Er lhiam's dy vel dooinney ass Yorkshire cummal ayn nish.","My grandfather and my father lived in the port itself, and our house was sold a few years ago. I think a man from Yorkshire lives in it now."
DQ_01,"My daink my jishag vooar erash as crankal er y dorrys as haink dooinney ass Yorkshire gys yn dorrys bee eshyn gra, 'Quoi ta shiuish, ghooinney? C'red t'ou jannoo ayns my hie?'","If my grandfather came back and knocked on the door and a man from Yorkshire came to the door he would say, 'Who are you, man? What are you doing in my house?'"
DQ_01,Bee enney eu er y thie. Raad va Allan cummal son bleeantyn.,You'll know the house. Where Allan lived for years.
DQ_01,"Va three thieyn obbree noi yn thie. Er yn kied 'er va gaaue gobbraghey, as er y nah 'er va my jishag vooar jannoo e wheeyllyn, as er yn trass er, er yn laare syrjey, va dooinney enmyssit Willy Clucas, va eshyn jannoo shiaullyn, whaaley shiaullyn ayns shen. Willie Clucas.","There were three workshops next to our house. In the first one a blacksmith worked, in the second one my grandfather made his wheels, and in the third one, on the upper floor, a man called Willie Clucas made sails."
DQ_01,Va'n thie shen creckit kuse dy vleeantyn er dy henney nish ansherbee.,That house was sold a few years ago now anyway.
DQ_01,"Aye, kuse dy vleeantyn. Agh v'eh ayns drogh stayd, ghooinney. V'eh agglagh, ghooinney. Va'n thie eh hene kiart dy liooar agh va ooilley ny thie obbree, v'ad ooilley ayns drogh stayd. Towllyn ayns yn laareyn as ooilley myr shen. V'eh agglagh. V'eh ayns feme jeh argid.","Aye, a few years ago. But it was in a bad state, man. It was awful, man. The house itself was alright but all the workshops were in bad condition. Holes in the floors and all that. It was awful. It needed money."
DQ_01,T'eh creckit nish ansherbee. T'eh ersooyl veih'n lught thie nish.,It's sold now anyway. It's left our family now.
DQ_01,As ren oo goll dy scoill ec scoill Rushen?,And did you go to school at Rushen school?
DQ_01,Scoill Rushen. Bleeantyn er dy henney nish. Daa as three feed bleeantyn er y henney.,Rushen School. Years ago now. Sixty two years ago.
DQ_01,As ren oo goll ersooyl gys Lerphoyl son traenal as yn lhied son goll er yn cheayn?,"And did you go to Liverpool for training and the like, for going to sea?"
DQ_01,"Tra va mee shey jeig hie mee gys Lerphoyl as va mee shiaull ersooyl marish yn Co-lught Harrison, as hie mee gys Lunnin lurg shen as va mee ersooyl gy mooir marish yn Colught yn Rollage Gorrym. As va ram deiney ayns yn colught shen as Gallic oc. Keeadyn jeu. Ooilley ass ny hEllanyn. Va mee geddyn greim er fockle ny ghaa jeh'n Gallic tra va mish ayns Colught yn Rollage Gorrym.","When I was sixteen I went to Liverpool and I sailed away with the Harrison Line, and I went to London, and after that I was away at sea with the Blue Star Line. And there were lots of men who spoke Gallic. Hundreds of them. All from the Islands. I learned a word or two of Gallic when I was in the Blue Star Line."
DQ_01,As row shen greinnaghey uss gynsaghey beggan Gaelg tra v'ou clashtyn yn Gallic goll er loayrt? Row Gaelg ayd ec yn traa shen?,And did that encourage you to learn a bit of Manx when you heard Gallic being spoken? Did you know any Manx at that time?
DQ_01,"Well va paart dy Ghaelg aym ec y traa t'ayn. Va mee goaill lioaryn marym tra va mish ersooyl, lhied jeh'n Kied Lessoonyn screeuit ec Goodwin as stoo myr shen. As dooyrt Doolish y Karagher, 'Ta shiuish ny dooiney ynrican ayns y theihll ta gynsaghey yn Ghaelg ayns y China' dooyrt eh, 'As ta mish yn dooinney ynrican ayns yn theihll oddagh loayrt Swahili as Gaelg Vanninagh' Shen myr dooyrt Doolish y Karagher.","Well I knew some Manx at that time. I took books with me when I was away, like the First Lessons written by Goodwin and things like that. And Douglas Faragher said, 'You're the only man in the world who is learning Manx in China' he said, 'And I'm the only man in the World who can speak Swahili and Manx Gaelic' That's what Douglas Faragher said."
DQ_01,Shen eh. Vel oo cooinaghtyn Doolish y Karagher dy mie?,That's it. Do you remember Douglas Faragher well?
DQ_01,Cre shen?,What's that?
DQ_01,Vel oo foast cooinaghtyn yn dooinney hene?,Do you still remember the man himself?
DQ_01,"Oh, dy jarroo. Tra va mish ersooyl ec mooir va mee screeu rish yn dooinney shen, as va eshyn gra, 'Tra ta shiuish ayns yn Ellan hig gys my hie as gynsaghey beggan tooilley Gaelg' Va eshyn slane goit ec yn Ghaelg, ghooinney. As s'bastagh dy dooar yn dooinney baase tra v'eh, well cha row eh ro henn ansherbee.","Oh, indeed. When I was away at sea I used to write to him, and he said, 'When you're on the Island come to my house and learn a bit more Manx.' He was completely fascinated by Manx, man. And it's a shame that he died when, well he wasn't that old anyway."
DQ_01,"Aye, s'bastagh nagh vel eh ayn yn laa t'ayn jiu son fakin ooilley'n sleih loayrt.","Aye, it's a shame that he isn't here today to see all the people speaking Manx."
DQ_01,Veagh shen jannoo foays da e chree. Bee shickyr dy shen.,That would have gladdened his heart. Be sure of that.
DQ_01,As t'ou cooinaghtyn Ned Maddrell.,And you remember Ned Maddrell.
DQ_01,"Va mee currit gys e thie dy jannoo coloayrtys marish yn dooinney shen agh va mee ro faitagh. Va mee boirit nagh veagh Gaelg dy liooar aym's dy loayrt rish lhied yn. . . Cha jagh mee gys y thing. Nish ta mee gra mee hene, 'Ta shen caa caillt, er lhiam' Agh va mee ro faitagh dy jannoo shen. Va enney mie er yn dooinney agh va mee ro faitagh dy goll gys e hie dy jannoo coloayrtys marish yn ard ghooinney eh hene.","I was sent to his house to talk to him but I was too shy. I was worried that I wouldn't know enough Manx to speak to the like... I didn't go to the thing. Now I say to myself, 'That's a chance lost, I think' But I was too shy to do that. I was well acquainted with the man but I was too shy to go to his house and make conversation with the great man himself."
DQ_01,Quoi elley va gynsaghey Gaelg tra v'ou gynsaghey ee?,Who else was leaning Manx when you were learning it?
DQ_01,"Well, tra va mish aeg, mysh shey jeig bleeantyn dy eash, va dooinney cummal ayns yn Straid Eayl ayns Purt le Moirrey ayns thie enmyssit Valley Veg.","Well, when I was young, about sixteen years old, there was a man living in Lime Street in Port St. Mary in a house called Valla Veg."
DQ_01,Oh yeah. Shione d'ou yn thie shen.,Oh yeah. I know that house.
DQ_01,"Va dooinney cummal ayns shoh enmyssit Walter Kodhere v'ad gra Walter Jane Ann- Cha nel, Walter Annie Jane Ann son far ennym rish yn dooinney shen. As va eshyn lhome lane dy Ghaelg, as v'eh dy kinjagh fockley magh padjer y Çhiarn er my hon ayns y Gaelg. As v'eh gynsaghey focklyn d'ou. As va blass feer feer lajer ec yn dooinney shen. Walter. Walter Annie Jane Ann. Er lhiam's dy row Annie Jane Ann e warree as va ish ben insee ec yn scoill Rushen ayns shoh. Annie Watterson, er lhiam's. Shen e warree er lhiam's. Agh va eshyn lhome lane dy Ghaelg. As va daa huyr ec yn dooinney shen. Va fer. . .enmyssit Olive, as shuyr elley, t'eh jarroodit aym yn ennym v'urree nish, agh va Gaelg ec y neesht jeu. V'ad fuirraght faggys da'n thie oast yn Baie ayns shen, er Primrose Terrace ayns shen. Va Gaelg dy liooar ec y neesht jeu. As va my ayr goll gys yn thie dy jannoo beggan dy daah ayns yn thie, as va my ayr çheet dy valley as v'eh gra rhym's ram focklyn ass y Gaelg ren eh gynsaghey ayns yn thie tra v'ad loayrt.","There was a man living there called Walter Watterson who they called Walter Jane Ann- no, Walter Annie Jane Ann as a nickname. And he was full of Manx, and he would always recite the Lord's prayer for me in Manx. And he taught me words. And his accent was very very strong. Walter. Walter Annie Jane Ann. I think Annie Jane Ann was his grandmother, who was a teacher at Rushen school here. Annie Watterson, I think. That was his grandmother, I think. But he was full of Manx. And he had two sisters. There was one...called Olive, and another sister, I've forgotten what her name was now, but they both knew Manx. They lived near to the Bay pub there, on Primrose Terrace there. They both spoke plenty of Manx. And my father went to the house to do a bit of painting in the house, and my father came home and told me lots of words in Manx that he had learned in the house when they were talking."
DQ_02,As ren oo goll dys brastyllyn marish Doolish y Karagher?,And did you go to classes with Douglas Faragher?
DQ_02,"Hie mee gys yn brastyl Ritchie son daa vleeaney, er lhiam's, ayns Balley Cashtal. Va shen yn kied vrastyl va mee ayn. Eisht hie mee gys yn brastyl Doolish y Karagher ayns Doolish son un vlein, er lhiam's. Va Derek Phillips ayn ayns y vrastyl cheddin ec y traa t'ayn, as kuse dy leih elley, Stewie Bennett as sleih myr shen. V'eh feer ymmydoil goll gys y vrastyl.","I went to Ritchie's class for two years, I think, in Castletown. That was the first class I was in. Then I went to Douglas Faragher's class for a year, I think. Derek Phillips was in the same class at that time, and a few other people. Stewie Bennett and people like that. It was very useful going to the class."
DQ_02,"Cha bee shiu geddyn greim er y choloayrtys mannagh vel shiu goll gys yn- t'ou slane caillt my row shiu lhaih eh, lhig dooin gra, yn Bible Casherick. T'eh feer doillee geddyn yn aght dy ockley magh eh, my t'ou laccal. Cha nel eh jannoo eh.","You won't get a hang of conversation if you don't go to- you're completely lost if you read, let's say, the Holy Bible. It's very difficult to get how to pronounce it, if you like. It doesn't do it."
DQ_02,As ta ram Gallic ayd nish.,And you know a lot of Gallic now.
DQ_02,Well tha facal na dha agam.,"Well, 'I know a word or two'"
DQ_02,So t'ou goll gys Ellan Barra feer vennick. Vel oo goll er yn vaatey ayd?,So you go to Barra often. Do you go in your boat?
DQ_02,"Cha nel. Er yn etlan, ghooinney.","No. On the plane, man."
DQ_02,"T'eh ro foddey dy gholl er y vaatey. S'cooin lhiam yn kied turrys, mysh jeih bleeaney er dy henney. Va mish loayrt marish carrey dooys, dooinney enmyssit Raghnall Campbell, as va shinyn cheu mooie jeh ny booaghyn, as va thie bee noa goll er karraghey heese yn traid, as haink ven magh ass yn shapp as dooyrt y ven rish my charrey, 'Bheil e fosgailte fhathast?' As va mee smooinaghtyn d'ou hene, dooyrt y ven, 'Vel eh foshlit foast? Is it open yet?'","It's too far to go in the boat. I remember the first trip, about ten years ago. I was talking to a friend of mine, a man called Ronald Campbell, and we were outside of the cows, and there was a new restaurant being renovated down the road, and a woman came out of the shop and the woman said to my friend, 'Bheil e fosgailte fhathast?' And I thought to myself, the woman said, 'Is it open yet?'"
DQ_02,"As dooyrt mee, 'Ta mee toiggal yn glare shoh, gyn ourys' 'Bheil e fosgailte fhathast?' dooyrt ish. As dooyrt mee rish my charrey, 'Dooyrt ish ""is it open yet?"" ?' 'Tha thu ceart. Tha thu ag ionnsachadh. You're learning' T'ee yn un red. T'ad gra thàinig - haink. Chì mi thu. As ooilley ny earrooyn, ooilley ny verbyn, dagh ooilley red, t'ad ooilley yn un red, agh t'ad fockley magh eh ayns aght beggan quaagh. My row shiu geddyn cliaghtit rish t'eh aashagh dy liooar dy toiggal eh.","And I said, 'I understand this language, without doubt' 'Is it open yet?' she said. And I said to my friend, 'Did she say ""is it open yet?""?' 'You're right. You're learning.' It's the same thing. They say thàinig – 'haink' [came]. Chì mi thu [see you]. And all the numbers, all the verbs, everything, they're all the same, but they pronounce it in a bit of a strange way. If you get used to it it's easy enough to understand it."
DQ_02,"Agh t'adsyn loayrt Gallic feiy'n laa gagh laa. Agh v'adsyn gra dy vel eh goll sheese y lhargagh ec y traa t'ayn, as dooyrt shenn fer insee ta cummal ayns Barra, dooyrt eshyn rhym's, 'Ta dooinney loayrt Baarle ayns gagh chorneil jeh gagh thie gagh oie' V'eh loayrt mychione yn chelveish. As dooyrt eh, va shenn sleih goit er y Vaarle er yn oyr dy vel ad smooinnaghtyn dy vel eh cool dy ve loayrt ass y Vaarle. Cha nel eh cool dy ve loayrt ass y Ghallic. Shen myr dooyrt yn dooinney shen.","But they speak Gallic all day every day. But they said that it's going downhill at the moment, and an old teacher who lives in Barra, he said to me, 'There's a man speaking English in every corner of every home every night.' He was talking about the television. And he said old people were taken by English because they thought it was cool to be speaking in English. It's not cool to be speaking Gallic. That's what this man said."
DQ_02,S'bastagh shen. Vel oo son goll dys Barra mleeaney?,That's a shame. Are you going to Barra this year?
DQ_02,"Aye, ayns mee ny ghaa. Ta mee er ve ayn jeih turrys, er lhiam's.","Aye, in a month or two. I've been on ten trips, I think."
DQ_02,C'raad t'ou tannaghtyn?,Where do you stay?
DQ_02,"Well, boayl erbee. Ta mee geddyn bwaane mar is trice. Mar is trice, ta shen Gallic, ghooinney. Mar is trice - 'most often'.","Well, anywhere. I get a cottage mar is trice. Mar is trice, that's Gallic, man. Mar is trice – 'most often'."
DQ_02,Ny s'menkey.,More often.
DQ_02,"Ta mee geddyn caillt, ny keayrtyn, eddyr y ghlare Vanninagh as y Ghallic.","I get lost, sometimes, between the Manx language and Gallic."
DQ_02,"Foddym toiggal shen. T'eh beggan doillee, nagh vel? Feer vie. Cre nee oo 'sy tourey ansherbee? Vel oo son jannoo veg? Well, goll dys Barra.","I can understand that. It's a bit difficult, isn't it? Very good. What are you doing in the summer anyway? Are you doing anything? Well, going to Barra."
DQ_02,"Aye, as goll gys y Rank dy chur shilley er my inneen. T'ee ayns yn ard scoill ayns shen. T'ee jannoo studeyrys er Frangish, as delladys. Delladys, t'ad gra rish.","Aye, and going to France to visit my daughter. She's at university there. She's studying French and business, I think. Business, they call it."
DQ_02,C'raad sy Rank?,Where in France?
DQ_02,"Leon, er lhiam's t'ee ayn. Eisht sy fouyr er lhiam's dy vel ee goll gys Bordeaux son jannoo startey son blein, agh lurg shen t'ee jannoo yn blein sy jerrey ec ard scoill ayns Chester, eisht foddee dy bee degree ecksh.","Leon, I think she's in. Then in the autumn I think that she's going to Bordeaux to work for a year, but after that she's doing the final year at university in Chester, then maybe she'll have a degree."
DQ_02,As c'red t'ee geearree- laccal jannoo lurg shen?,And what does she want to do after that?
DQ_02,Cha nel ish smooinaghtyn mychione y lhied shen. T'ee just smooinaghtyn mychione goll magh er yn oie ec y traa t'ayn.,She's not thinking about that type of thing. She's just thinking about going out at night at the moment.
DQ_02,Cre'n fa nagh.,Why not.
DQ_02,"T'ee jannoo delladys as t'ee jannoo Frangish. Ta mish er gra, 'Bee startey mie ayd's ayns Ellan Vannin' 'Oh, cha nel. Beeym goll ooilley mygeayrt y theihll' dooyrt ee. Hee shin.","She's doing business and she's doing French. I've said, 'There'll be a good job on the Isle of Man' 'Oh, no. I'll be going all round the world' she said. We will see."
DQ_03,As cre mychione dty vac? Vel eh gobbraghey mayrt er y vaatey?,And what about your son? Is he working with you on the boat?
DQ_03,Er y vaatey. T'eh er ve er y vaatey three bleeaney nish. T'eh jannoo dy mie. Dooinney lajer. Dooinney braew t'eh. As tra ta mish my haaue s'treisht lhiam bee eshyn goll magh ayns y vaatey eh hene. S'treisht lhiam.,"On the boat. He's been on the boat three years now. He's doing well. Strong fella. Fine fella, he is. And when I'm retired I hope he'll go out on the boat himself. I hope."
DQ_03,"As bee obbyr ry gheddyn er y cheayn 'sy traa ry heet, t'ou smooinaghtyn?","And will there be work on the sea in the future, do you think?"
DQ_03,"Er lhiam. Bee dy kinjagh reddyn 'sy keayn. Er lhiam's. T'ou lhaih, mennick dy liooar, ayns y pabyryn niaght mychione. T'ad gra dy vel ooilley ny mooiryn er n'gheddyn baase as stoo myr shen. Cha nel shen kiart. Ta cho monney cretooryn ayns y cheayn myr va rieau, er lhiam's. Ny keayrtyn ta millioonyn jeu.","I think so. There will always be things in the sea. I think. You read, quite often, in the newspapers about it. They say that all the seas have died and things like that. It's not right. There's as many creatures in the sea as there ever was, I think. Sometimes millions of them."
DQ_03,"Vel? Vel oo- Gow er, ghooinney.","Is there? Do you—Go on, man."
DQ_03,Vel oo rieau goll er y cholloo er chor erbee?,Do you ever go to the Calf at all?
DQ_03,"Ny keaytyn. Tra ta lane tidey ayn ta shin goll stiagh ayns yn Purt y Jiass ny keayrtyn as shooyl mygeayrt son lhieh oor as ersooyl lhien. Son sorch dy, cha nel laaghyn seyrey, but lieh oor dy aash, my t'ou laccal.","Sometimes. When it's high tide we go into South Harbour sometimes and walk about for half an hour and then away. For a sort of, not holiday, but half an hour of rest, if you like."
DQ_03,As vel monney sleih goll er yn eeastagh son gimmee ec yn traa t'ayn?,And are there many people fishing for lobsters at the moment?
DQ_03,"Oh, ram jeu.","Oh, lots of them."
DQ_03,"Rour, foddee?","Too many, perhaps?"
